Attraction_A15011200H_000156,Attraction,Zh_tw,石硦林場,石硦林場位於阿里山下，坐落於嘉義縣中埔鄉的桶頭山，是一處森林面積達30公頃的近郊型自然生態區，林場內生態資源相當豐富多元，且沿途步道鋪設完整，山頂還能眺望市區美景，是一座充滿發現的隱藏版森林步道！石硦林場擁有多條不同難度的步道可供選擇，無論是長約1公里，適合老人、小孩一同體驗自然生態的輕鬆步道；或是1.8公里長，能充分感受森林之美的休閒步道；亦或是全長3.8公里，一路登頂桶頭山，享受登高臨下快感的觀景步道，無論腳程、體力如何，都能在石硦林場盡情體驗自然生態之美。走進石硦林場，首先映入眼簾的便是入口處可愛的石猴橋，以非禮勿視、非禮勿言、非禮勿聽為主題的猴子雕像十分逗趣。接著便隨著石板道漸漸走進森林的懷抱。林場內的步道全程都十分好走，不論是木棧道、石板道、水泥步道或原木步道，就算是不常運動的人，...,(06)6900399,,嘉義縣,中埔鄉,嘉135-2鄉道,A15011200H,交通部觀光署西拉雅國家風景區管理處,2024/6/26 下午 04:28:51,148000
Attraction_376490000A_000114,Attraction,Zh_tw,二崙新虎溪,新虎尾溪位於本鄉南邊，隔岸與虎尾鎮相對，中部科學園區虎尾園區及高鐵虎尾站，位於湳仔村隔岸之南面，日後對本鄉的發展有相當影響，水利會在湳仔村地段，施設橡膠壩調節水位，並引流至別線，用以灌溉附近農田，這裡設有一處運動休閒公園，適合早上來此，站在壩橋上觀賞晨曦，欣賞就台糖之鐵道，然後走一走石頭堆砌之健康步道，或是打打拳拉筋，把一天的能量儲存起來，有健康的身體就有源源不斷的財富跟著來。  這裡設有一處運動休閒公園，適合早上來此，站在壩橋上觀賞晨曦，欣賞就台糖之鐵道，然後走一走石頭堆砌之健康步道，是運動休閒的好去處。,(05)5982001,,雲林縣,二崙鄉,雲林縣二崙鄉湳仔村,376490000A,雲林縣政府,2021/12/28 下午 04:04:59,147000
Attraction_A15010400H_000236,Attraction,Zh_tw,龍坑自然生態保護區,位於佳鵝公路的起點，龍坑是一座隆起的珊瑚礁，以粗獷原野的地形聞名，旺盛的侵蝕作用成就了龍坑全區的崩崖裙礁，峽谷等獨特的地形，由於形狀如同一條龍，龍坑因而得名。龍坑地形可分為海濱草原、珊瑚礁台地、峽谷、溶蝕、崩崖等五部分，其中草原上成群的白水木和珊瑚礁上大片水莞花是台灣目前最大的族群，氣勢磅礡，兩旁陡峭礁岩，置身其間有如走入洪荒時代的株羅紀公園，龍坑生態保護區，需事先向墾丁國家公園管理處申請核准才可進入。,(08)8851322,,屏東縣,恆春鎮,鵝鑾里燈塔路51巷25號,A15010400H,交通部觀光署大鵬灣國家風景區管理處,2025/5/12 下午 12:15:05,147000
Attraction_382000000A_403410,Attraction,Zh_tw,四分尾山,四分尾山位於汐止鬧區南方的山系，得名於其如四面金塔形的山勢，是周遭四個聚落的界山，另有一別稱為茄苳腳山，從天秀宮登山口出發單程約2.8公里，途中會先經過知名的小百岳-汐止大尖山。相較於標高400多公尺高的大尖山，四分尾山依著641公尺的海拔高度，享有更接近天空的遼闊，天氣晴朗的日子裡，不僅能欣賞臺北市區的城市景色，向東北方望去，基隆港、基隆嶼也儼然在視野內，四分尾山也是昔日往來汐止、石碇與南港地區的必經之路，欣賞美景之餘也踏查了先人的足跡。,(02)29603456,,新北市,汐止區,石汐路,382000000A,新北市政府觀光旅遊局,2022/12/5 上午 08:12:23,147000
Attraction_379000000A_003170,Attraction,Zh_tw,彩虹河濱公園,彩虹河濱公園位於基隆河中山高速公路至麥帥一橋之間，彩虹橋橫跨於成美左、右岸河濱公園，紅色悠美的S型橋體是許多攝影者愛好的拍攝地點。在彩虹橋下的河濱廣場有情人們設計一系列的愛情主題造景，包括標示12種「我愛你」語文的情人步道、情人座椅、LOVE立體文字雕塑、愛情鎖等，歡迎情人們前來感受水岸浪漫氛圍。,(02)27258149,,臺北市,內湖區,,379000000A,臺北市政府,2024/3/31 下午 02:06:01,147000
Attraction_376490000A_001332,Attraction,Zh_tw,明陣,石壁的竹林明陣採雙螺旋設計，進入和出來是不同路徑，不會交錯，形狀看似簡單、然運行有秩，提供個人漫步靜心，也可以做為團體療育活動的場地。,(05)5523184,,雲林縣,古坑鄉,雲林縣古坑鄉(草嶺石壁森林療癒基地),376490000A,雲林縣政府,2024/7/2 下午 05:31:06,147000
Attraction_387000000A_001738,Attraction,Zh_tw,萬選居,「萬選居」起造人張始習（1802-1872），號萬春，祖籍為廣東省潮州府大埔縣之客家人，渡臺祖張達京（1690-1773）與其墾號「張振萬」，在漢人入墾中部地區扮演重要角色。張始習於清同治10年（1871）起造「萬選居」，隔年逝世後，由膝下4子承襲續建，同治12年（1873）正式落成。,(04)22290280,,臺中市,豐原區,豐年路149巷10弄16號,387000000A,臺中市政府觀光旅遊局,2025/5/8 下午 05:11:28,146000
Attraction_379000000A_002939,Attraction,Zh_tw,大直植福宮,大直植福宮乃大直地區居民之生活精神信仰中心(含中山區、內湖區、士林區)，也是國際觀光團寺廟建築暨文化觀光旅遊勝地之一。大直植福宮至今已有二百多年歷史，供奉道教神『福德正神』為主神，遵照道廟體制和精神，安祀配神，以宏揚道教教義、樹立民間正信、導正人心向善、淨化社會暨發揚民俗固有文化道德及辦理社會慈善公益事業為宗旨。另外大直植福宮亦供奉暨送子觀世音菩薩、天上聖母、保儀大夫、保生大帝、文昌帝君、關聖帝君、李池吳朱范五府千歲(王爺公)等神祇。全年供善信大德安奉太歲燈光明燈平安燈文昌燈財利燈祈福臻祥福慧圓滿。正月初一日：子時十一點十五分頭香，賀禧、神恩垂佑。正月初十日：新春開燈安奉『值年太歲星君、平安燈、光明燈、文昌燈、財利燈』祈福元辰光彩八節慶餘。正月十五日：天官大帝聖誕千秋，『祈安植福法會』。二月初二日：福德正神千秋，慶祝『土地公生植福聯歡』活動。暨土地公會聯誼餐會。 二月初三日：文昌帝君梓童聖誕千秋。二月十九日：觀世音菩薩佛誕千秋。三月十五日：保生大帝吳真人聖誕千秋。三月卄三日：天上聖母聖誕千秋，『祈安植福法會』。四月初十日：保儀大夫張巡聖誕千秋。四月十七日：大直土地重劃建廟安座週年慶。四月卄六日：五府千歲李王爺聖誕千秋。四月卄七日：五府千歲范王爺聖誕千秋。六月十五日：五府千歲池王爺聖誕千秋。六月十九日：觀世音菩薩得道千秋。六月卄四日：關聖帝君聖誕千秋。七月十八日：慶讚中元『普渡法會』。七月十九日：值年太歲星君千秋。八月十五日：土地公得道飛昇、五府千歲朱王爺聖誕千秋。八月十六日：福壽會聯誼餐會。十三日起中秋乞龜活動。九月十五日：五府千歲吳王爺聖誕千秋。十月十五日：水官大帝聖誕千秋，『祈安植福法會』。十二月卄二日：年終謝燈，功德圓滿。每月初二、十六日：誦經疏文祈福，爐下第子福慧臻祥。(資料來源：大直植福宮),(02)25323316,,臺北市,中山區,,379000000A,臺北市政府,2024/9/24 下午 10:00:43,146000
Attraction_376430000A_000966,Attraction,Zh_tw,中原商圈 (中原夜市),有令你熟悉的在地小吃，也有大玩混搭的創意美食，華燈初上時，整座夜市一路飄香，只要你｢肚量｣夠大，歡迎過足你的吃貨癮。,(03)3322101,,桃園市,中壢區,中原大學周邊(實踐路與日新路),376430000A,桃園市政府觀光旅遊局,2024/6/19 下午 04:27:52,146000
Attraction_376540000A_001285,Attraction,Zh_tw,鐵花新聚落,位於臺東市中心的臺東舊火車站於2001年交棒給新車站後，卸下了原有的交通樞紐地位，在經由縣府與在地聯手努力後，臺東舊站一帶成功轉型為鐵花新聚落，華麗轉身為臺東的文創與潮流重鎮，夜晚漫步於高掛彩繪熱氣球的鐵花新聚落已是當今來臺東必遊的行程之一。鐵花新聚落範圍涵蓋了TTstyle原創館、鐵道藝術村、秀泰影城、臺東轉運站以及市集。不定期舉辦各類藝文活動，讓臺東充滿豐富的樂趣與文創氣息！鐵花新聚落中有不定期精彩音樂節目演出及文創手作、特色美食市集是一個讓創作人才自由發表的空間，儼然是臺東的音樂的集散地。TTstyle原創館又稱作波浪屋，波浪天頂的設計概念來自於臺東山與海的意象，豪邁伸展的曲線，有如海浪的湧動，層疊山峰的壯碩；下方恩典之柱的圖騰的設計，紀錄原住民祖先的生活態度與文化。原創館整體結構以貨...,(089)332334,,臺東縣,臺東市,鐵花路369號,376540000A,臺東縣政府交通及觀光發展處,2024/12/2 下午 06:11:29,146000
Attraction_387000000A_000333,Attraction,Zh_tw,臺中市大墩文化中心,"臺中市素有文化城之美譽，文風鼎盛，教育事業發達，社會各界對於文化活動的推展，不遺餘力。民國65年，由名企業家何永先生於雙十路捐建文化中心一座，為全臺第一間文化中心。民國68年，中央政府推動12項建設，補助各縣市設立一座文化中心，本市擇於英才路600號籌建，翌年8月開工，並於72年11月12日竣工啟用，面積16,615平方公尺，定名為「臺中市立文化中心」。(原雙十路文化中心於72年改為「文英館」，並於101年交國立臺灣體育運動大學管理。)99年12月25日臺中縣市合併升格直轄市後，定名為「臺中市立大墩文化中心」，102年1月1日改制納編為文化局內部單位，定名為「臺中市政府文化局大墩文化中心」。臺中市大墩文化中心管理範圍包含中山堂，並與「臺中市立圖書館大墩分館」合署辦公，場域內有10間展覽室，另...",(04)23727311,,臺中市,西區,英才路600號,387000000A,臺中市政府觀光旅遊局,2024/4/3 下午 04:20:21,146000
Attraction_A15010100H_000105,Attraction,Zh_tw,綠島燈塔,"西元1939年建造的綠島燈塔，位於台東縣綠島鄉之西北海岸高地，塔身為圓形鋼筋混泥土結構。綠島舊名火燒島，是台灣東南海面以及太平洋海域往來船隻的必經之地，由於綠島外海暗礁岩石密佈、時有船隻觸礁失事，西元1937年更發生「胡佛總統號」郵輪觸礁沉沒一事。而在「胡佛總統號」船難發生時，1,000多名遊客被綠島居民奮勇救起，美國紅十字會為感謝綠島居民勇敢救人的義舉，乃於翌年的追悼紀念活動中捐款興建綠島燈塔。",(089)672540,,臺東縣,綠島鄉,綠島燈塔,A15010100H,交通部觀光署東部海岸國家風景區管理處,2025/5/6 下午 05:46:09,145000
Attraction_387000000A_000033,Attraction,Zh_tw,中正露營區,中正露營區位於台中市大坑頭嵙山西方，海拔四六五公尺，是大坑規模最大的公營露營地。中正露營區各個營地皆有石階步道相連，但各自有獨立、不受干擾的隱蔽性，共可容納1500餘人在此紮營活動，區內公共設備齊全，並提供營帳、炊具等出租服務。營區內的相思樹林，是能讓人充份享受大自然野趣的所在。,(04)22390685,,臺中市,北屯區,連坑巷,387000000A,臺中市政府觀光旅遊局,2023/9/28 下午 07:24:12,145000
Attraction_376540000A_000377,Attraction,Zh_tw,綠島燈塔,綠島燈塔興建於日治時期昭和十四年(1939)，位於綠島西北岬中寮村內，緊鄰鼻頭角。塔高33.3公尺，外觀為白色直筒狀建築，佇立於一片綠意盎然的草地之上，頂著藍天白雲，宛若一幅印象派的絕佳畫作。到了夜晚，它便搖身一變成為「航海人的守護者」，是漁船、飛機的重要指標，亦為太平洋上深具歷史意義的一盞明燈。,(089)672540,,臺東縣,綠島鄉,環島公路1公里處,376540000A,臺東縣政府交通及觀光發展處,2025/4/23 下午 04:52:14,145000
Attraction_A15010700H_000047,Attraction,Zh_tw,千櫻園,千櫻園 位於高海拔的福壽山農場「千櫻園」，於2019年1月22日正式開放遊客參觀。佔地8公頃，種植多樣品種櫻花。一、二月份的緋寒櫻、昭和櫻、富士櫻；三、四月份的大島櫻、鬱金櫻，及特殊品種葉櫻、菊櫻、御衣黃櫻&hellip;&hellip;，一共種植約6000株櫻花，於不同時節依序綻放。櫻花季來臨時，遊客能抬頭欣賞深淺不一的漸層粉嫩花海，亦可俯瞰四周綿延的環繞山景。同時，園內設有幾處LOVE字樣的休憩涼亭，搭配粉嫩櫻花景致，浪漫氣氛加倍。 千櫻園生態景觀園區中，妥善規畫步道及觀景台，使得處處都成為賞櫻好地點，亦提供無障礙坡道，使行動不便之遊客也能便利地欣賞美景。而此處並無廁所及垃圾桶，因此，呼籲遊客進入此區前，記得先上廁所，並且，於園區當中不隨意丟棄物品，個人垃圾務必帶走，維持景點整潔及美觀。...,(04)25989202,,臺中市,和平區,福壽路,A15010700H,交通部觀光署參山國家風景區管理處,2024/6/25 下午 02:29:33,144000
Attraction_376480000A_000403,Attraction,Zh_tw,廣靈宮,農曆七月舉辦觀音送平安粽，信眾透過「解」粽繩，象徵解開「心結」的方式，盼在神明庇佑下大家能平平安安、健健康康。,(049)2262408,,南投縣,南投市,同源路八街12號,376480000A,南投縣政府觀光處,2023/6/30 下午 05:30:00,144000
Attraction_379000000A_001984,Attraction,Zh_tw,原住民文化主題公園,臺北市外雙溪故宮博物院鄰近的公園，特別地規劃呈現原住民文化意象的主題風格，打造更有味道的原住民文化主題公園，包括各族人像石牌、少年與狗石像搗米人像、手紋像、人紋像、及大熊像、梅花鹿像、母與子石像等作品等，讓市民在臺北市內就可以接近原住民的生活；公園入口廣場寬闊氣勢擎天，向內沿著滿佈圖騰的圖騰地磚園路步行，進到湖畔水木棧廊道區，水邊種植落羽松群及多種水生植物如野薑花及睡蓮等，沿路以石板製成的石椅、石牆及各式圖騰地磚，配合生長的爛漫恣意的各式原生植物，營造一個含有豐富生態及展現原住民生活的意象。原住民文化主題公園不僅陳列原住民的藝術作品，也介紹了臺灣平埔族、雅美族、噶瑪蘭族、賽德克族、布農族、卑南族、排灣族、魯凱族、阿美族、鄒族、邵族、賽夏族、泰雅族的文化及緣起，藉由原住民順應自然的態度及精神，讓我們得以更了解原住民的生活藝術世界，原住民主題文化公園歡迎您的到訪。文字來源／公園走透透.臺北新花漾網站,(02)28812512,,臺北市,士林區,,379000000A,臺北市政府,2024/9/6 上午 11:47:56,144000
Attraction_379000000A_002181,Attraction,Zh_tw,公館商圈,公館商圈鄰近臺灣大學、臺灣科技大學、師範大學公館校區，提供市民及學生食衣住行育樂機能性完善的購物商圈，除了擁有符合外國遊客和交換生口味的各式異國料理餐廳，也有美食咖啡廳及著名的手搖飲料店；日常服飾及體育用品商家眾多，買衣買鞋都非常方便；同時公館商圈位於臺北市南區的重要交通樞紐地帶，大眾運輸發達又便利。因學區而匯聚各式獨立書店、咖啡廳、二手小店...等的公館商圈溫羅汀(溫州街、羅斯福路、汀州路)，是華文世界書店密度最高的區域，使得公館商圈增添了不少人文特色及文青氣息。粗略統計，方圓小於一公里的公館域內密布至少約四十家以上的特色書店、二十家以上的人文咖啡店與數家彰顯搖滾精神之地下音樂場所，更遑論首屈一指的NGO集中特色，在學院主義與象牙塔教條外，以文化精神驅動出意識竄流、拼貼切分的地下社會。此外公館商圈周圍景點眾多，包含自來水園區、寶藏巖國際藝術村、自來水博物館、水源劇場、公館夜市，計畫到景點遊玩的遊客，也可以到公館商圈逛街吃美食，安排一日遊或半日遊都非常適合。(部分資料來源：臺北市政府文化局),(02)28736580,,臺北市,大安區,,379000000A,臺北市政府,2024/3/28 上午 10:53:26,144000
Attraction_376470000A_000093,Attraction,Zh_tw,鹿港地藏王廟,鹿港以北有天后宮，南據地藏王廟，代表鹿港南北一司天、一司地的聚落族群信仰觀。地藏王之信仰在鹿港深受重視，中元普渡時本廟香火鼎盛，祭典非常隆重，平日緊閉的大門，此時敞開放庵，並施「盂蘭盆會」，直至入夜收庵。,(04)7774764,,彰化縣,鹿港鎮,彰化縣鹿港鎮力行街2號,376470000A,彰化縣政府城市暨觀光發展處,2023/5/17 上午 09:52:17,144000
Attraction_387000000A_000786,Attraction,Zh_tw,草悟道,從國立自然科學博物館、勤美誠品綠園道，至市民廣場，如行草般的行雲流水，發現生活感動；從藝文空間、國立臺灣美術館，到特色美食，如悟道般的樂活心靈，體會都市脈動；在草悟道，悠遊於綠意之間，看見一座城市的兩種態度。,(04)22289111,34000.0,臺中市,西區,向上北路,387000000A,臺中市政府觀光旅遊局,2024/3/26 上午 10:44:42,144000
Attraction_376430000A_000381,Attraction,Zh_tw,慈湖遊客中心,踏進滿有人文感的展示空間，跟著兩蔣生平，回顧泛黃的歷史篇章，外地人遊北橫的各種大哉問，同樣也能不費力獲得詳盡解答。,(03)3884437,,桃園市,大溪區,復興路一段1097號,376430000A,桃園市政府觀光旅遊局,2024/9/19 下午 04:33:44,143000
Attraction_376440000A_000260,Attraction,Zh_tw,華光照相館,,(03)5963312,,新竹縣,竹東鎮,仁愛路312號,376440000A,新竹縣政府交通旅遊處,2025/4/10 上午 09:09:41,143000
Attraction_379000000A_002169,Attraction,Zh_tw,臺北市議會,臺灣光復初期，為奠定地方自治基礎，民國34年12月26日臺灣省行政長官公署公布「臺灣省各級民意機關成立方案」 ，並根據國民政府公布的「市參議會組織條例」及「參議員選舉條例」，於民國35年4月15日成立臺北市參議會；參議會雖為民意機關，但在當時僅具諮詢性質而已。民國38年12月7日國民政府遷臺後，地方自治制度並未遵循憲政體制運作，於民國39年4月24日另頒「臺灣省各縣市實施地方自治綱要」做為在臺灣推動地方自治的依據，該會隨之進入省轄市市議會時期。民國56年7月1日臺北市由省轄市升格為直轄市，迄至第１屆直轄市議會成立為止(民國58年12月25日)為過渡時期，由臺北市臨時市議會踐行職權。但有關直轄市自治的法制並未完備，仍以行政命令－民國56年6月22日行政院訂頒「臺北市各級組織及實施地方自綱要」做為直轄市自治的法源。民國83年7月29日「直轄市自治法」公布施行後，臺北市議會在地方自治的立法權、財政監督權及行政監督職權，始獲得法律保障，並真正落實憲法條文第118條「直轄市之自治，應以法律定之」的規範。為因應中央與地方分權的時代潮流，民國88年1月25日公布施行的「地方制度法」，將直轄市與省縣(市)自治分流的規範整合為一，開啟臺灣地方自治發展史的新頁。臺北市議會為地方立法機關，代表市民監督市政，由代表多元社會的各區議員行使立法職權。在經由提案、討論、辯論、協商的過程中，依「服從多數、尊重少數」的多數決民主原理，使多元的民意，能夠成為市民共同遵循的政策與法律，保障地區住民的權益。近年來，議會在致力反映民意、監督市政、府會關係和諧、政黨協商、城市交流之餘，也戮力提昇議事資訊公開及e化等工作。希透過立法監督，督促市政府興利除弊、增進市民福祉、提高市民生活品質，克盡地方立法機關職責。(資料來源：臺北市議會),(02)27297708,,臺北市,信義區,,379000000A,臺北市政府,2024/9/6 上午 10:13:24,143000
Attraction_376470000A_000018,Attraction,Zh_tw,溪湖糖廠,"溪湖糖廠溢著甜意和懷舊的氣息，結合了文化、休閒和美食；不僅完整地保留昔日的製糖工廠，巨大的煙囪、煮糖蒸發槽，瀰漫著「蒸氣龐克」的氣息，更有古老蒸汽火車頭，舊鐵軌上的五分車依然穿梭，換上彩妝復活載客，而古色古香的老建築，則成了一棟棟販售著枝仔冰、新潮的甜點和冰淇淋等專賣店，偌大園區還有林境森林、綠草如茵，並設有大型烤肉區、生態池等，多元豐富，是彰化的人氣觀光景點。

台灣一度是亞洲糖業最大輸出國，溪湖糖廠更曾是全台製糖量最高的糖廠，走過輝煌的歷史，結束營業後，偌大製糖工廠，引領感受百年糖業的風華，政府相關單位也曾爭取列入「世界工業遺產」，可見規模之浩大和蘊藏的魅力。",(04)8852111,,彰化縣,溪湖鎮,彰化縣溪湖鎮彰水路二段762號,376470000A,彰化縣政府城市暨觀光發展處,2024/11/22 下午 01:46:11,143000
Attraction_376490000A_000140,Attraction,Zh_tw,雲科生態休閒農場,"賞花採果摸泥鰍
雲科生態休閒農場以種植柑橘類為主，秋冬可參與採果體驗，春夏則以賞花、控窯、童玩DIY為主要活動。在全雲林縣最大的泥鰍池中親子共遊，可以感受早年抓泥鰍的農村風情。",(05)5338447,,雲林縣,斗六市,雲林縣斗六市大學路二段273巷67號,376490000A,雲林縣政府,2023/7/13 下午 03:23:02,142000
Attraction_382000000A_109636,Attraction,Zh_tw,瑞芳火車站旅遊服務中心,本服務中心位於瑞芳火車站內，每日服務人次達上千人，且瑞芳火車站旅遊服務中心榮獲交通部觀光局98年度全國交通站旅遊服務中心督導考核評比作業成績名列前3名，服務品質卓著。服服務時間為上午9時至下午6時，全年無休提供多項貼心服務。提供包括中、英、日語觀光旅遊專人諮詢服務、旅遊景點介紹、交通住宿、規劃行程服務、慶典活動、導覽解說、網路或電話查詢，97年增設媒體導覽機、電子看板，讓遊客能立即得到新北市旅遊的詳盡資訊。,(02)24973813,,新北市,瑞芳區,明燈路3段82號,382000000A,新北市政府觀光旅遊局,2021/7/16 上午 09:21:55,142000
Attraction_397000000A_000918,Attraction,Zh_tw,美濃文創中心,座落於美濃最古老的永安老街，1902年興建的「美濃警察分駐所」是和洋融和的巴洛克歷史建物，經過多年修復已是旅遊服務中心,(07)6819265,,高雄市,美濃區,永安路212號,397000000A,高雄市政府觀光局,2024/5/17 下午 03:21:04,142000
Attraction_379000000A_000061,Attraction,Zh_tw,新北投溫泉商圈,北投溫泉從日據時代便有盛名，喜愛泡湯的日本人自然不會錯過，瀧乃湯、星乃湯、鐵乃湯就是日本人依照溫泉的特性與療效給予的名稱，據說對皮膚病、神經過敏、氣喘、風濕等具有很好的療效，也因此成為了北部最著名的泡湯景點之一。新北投溫泉的泉源為大磺嘴溫泉，泉質屬硫酸鹽泉，PH值約為3~4之間，水質呈黃白色半透明，泉水溫度約為50-90℃，帶有些許的硫磺味 。目前北投的溫泉旅館、飯店、會館大部分集中於中山路、光明路沿線以及北投公園、地熱谷附近，每一家都各有其特色，多樣的溫泉水療以及遊憩設施，提供遊客泡湯養生。鄰近的景點也是非常值得造訪，例如北投溫泉三寶的吟松閣、星乃湯、瀧乃湯以及記錄臺灣第一家溫泉旅館的天狗庵史蹟公園，都有著深遠的歷史背景。而北投公園、北投溫泉博物館、北投文物館、地熱谷等，更是遊客必遊的景點，來到北投除了可以讓溫泉洗滌身心疲憊，也可以順便深入了解北投溫泉豐富的人文歷史。,(02)28955418,,臺北市,北投區,,379000000A,臺北市政府,2024/11/4 下午 05:32:06,142000
Attraction_397000000A_000176,Attraction,Zh_tw,旗山橋,旗山位於高雄市的咽喉地帶，扮演高雄平原與山區的轉運站角色，因此連絡楠梓仙溪兩岸的旗山橋地位極為重要。,(07)6616100,,高雄市,旗山區,中華路上,397000000A,高雄市政府觀光局,2022/4/19 下午 03:30:25,142000
