唯一識別碼,資料類型,語系,資料名稱,文字描述,聯絡電話,分機,縣市名稱,行政區(鄉鎮區)名稱,街道名稱,資料提供單位機關代碼,資料提供單位,資料更新日期時間,search_count
Attraction_395000000A_000726,Attraction,Zh_tw,臺南車站,南火車站日治時期稱為台南驛，最初之站房興建於一九ＯＯ年(日明治三十三年)五月，為一洋風式樣之建築。此建築經過三十多年之使用，已經逐漸不敷使用而且老舊，不足以成為發展中之台南市之門面，因而改建之聲不斷，鐵道部當局也為此甚費苦心。一九二七年(日昭和二年)，縱貫鐵路台北竹南段與台南高雄段的雙線工程被認可後，懸宕已久台南站重建之事也獲得解決。 台南火車站為一棟二層樓之建築，空間型態可視為是由前(西)面之大廳棟、中間之候車棟及後(東)面之月台所組成。大廳之前有門廊，正面為供汽車旅客上下之入口，兩側為行人入口，今,(06)2261314,,臺南市,東區,北門路二段4號,395000000A,臺南市政府,2024/1/9 下午 04:06:59,20500000
Attraction_387000000A_000070,Attraction,Zh_tw,臺中市第二市場,位於臺中市中區三民路與台灣大道一段處，是台中美食集中地。市場內的爌肉飯、麻芛、香菇肉羹、紅茶、麵攤，都是有數十年歷史的老小吃攤，隨意撿家坐下，端上的都是一碗碗經過數十年歲月，無數老饕鑑賞過的美食。在此，你也可以見到許多台中老饕來這一解嘴饞。在逛街品嚐美食之際，別忘了抬頭看看市場內歷史悠久的屋頂、或是街角的樓梯。,(04)22289111,,臺中市,中區,三民路二段87號,387000000A,臺中市政府觀光旅遊局,2025/5/6 下午 05:04:36,20300000
Attraction_379000000A_002881,Attraction,Zh_tw,三創生活,"「三創生活」坐落於市民大道三段與金山北路交界，佔地2,687坪，建築外觀呈現前瞻氣勢，立面設計詮釋產業特性，結合鄰近綠帶的視野，實踐自然與科技共生的設計理念。空間規劃導入科技生活、潮流影音、子親娛樂、動漫文化、探索體驗、創作育成及藝術展演等多元概念，結合園區內隨處可見的數位視屏，讓影像的多元樣貌，觸動對生活的無限想像。園區以人為核心，打造實踐未來的生活平台。期待能藉由互動、分享、探索、學習與創作，帶領大眾重新建構科技、文化與生活的連結。園區共12層樓，緊鄰光華數位新天地，提供選購3C產品的更多選擇。",0809093300,,臺北市,中正區,,379000000A,臺北市政府,2024/12/15 上午 05:01:53,18600000
Attraction_387000000A_000028,Attraction,Zh_tw,臺中公園,臺中公園自1903年(明治36年)10月28日創立以來，一直是臺中市重要的地標，公園內設有人工湖、亭臺樓閣、曲橋等優美造景，還有露天音樂臺、兒童遊戲區、網球場等多項遊樂設施，適合親子一同前往休閒運動，因位於臺中市區，交通方便，成為臺中市一個假日闔家出遊的熱門景點。,(04)22224174,,臺中市,北區,雙十路一段65號,387000000A,臺中市政府觀光旅遊局,2024/11/1 下午 01:33:48,16400000
Attraction_376440000A_000027,Attraction,Zh_tw,新竹縣婦幼館,,(03)5510627,,新竹縣,竹北市,縣政二路620號,376440000A,新竹縣政府交通旅遊處,2025/4/28 上午 06:09:00,15600000
Attraction_387000000A_001138,Attraction,Zh_tw,新臺中火車站,「台中都會區鐵路高架捷運化計畫」歷經多年爭取、規劃及興建，在中央地方通力配合下，台鐵列車改駛高架橋上，高架車站同步啟用。台中都會區鐵路高架北起豐原站北側1.9公里，南迄大慶站南邊1.4公里，全長21.7公里，除現有5座車站改建為高架車站，並增建栗林、頭家厝、松竹、精武及五權等5座高架通勤站。其中大慶及松竹站，與台中捷運綠線共站轉乘，結合軌道運輸路網，讓百年鐵路展現全新風貌。,(04)22227236,,臺中市,中區,臺灣大道一段1號,387000000A,臺中市政府觀光旅遊局,2024/4/8 上午 11:16:39,14800000
Attraction_A15010100H_000028,Attraction,Zh_tw,加路蘭,加路蘭鄰近富岡地質公園(小野柳)，有寬廣的草坪、涼亭、解說站以及觀景台，是東海岸旅行的最佳休息站，區內延續著風化、海蝕景觀，海岸線條紋路特殊，草地上也有不少漂流木裝置藝術作品，是東海岸之旅必遊之地。,(089)281530,,臺東縣,臺東市,加路蘭遊憩區,A15010100H,交通部觀光署東部海岸國家風景區管理處,2025/5/6 下午 05:03:13,14200000
Attraction_382000000A_110836,Attraction,Zh_tw,新北市政府行政大樓,新北市政府行政大樓於92年3月24日完工啟用。這是一棟地上33層、地下4層、樓高140.5米的科技化、智慧型大樓，期為新北市民提供高品質、高效率的服務。新北市政府大樓與台鐵、高鐵及捷運三鐵共構的板橋車站、長途客運站、公車站透過新府路及新站路地下通廊相貫連，交通便捷，四通八達。市府大樓除了提供員工優質的辦公環境外，也提供托兒所、餐廳、麵包店、觀景餐廳、暸望層等多功能的服務場所，1樓大廳還有公共空間的展覽設計，與之連接的市民廣場，不僅有綠意盎然的花草樹木，更不定時有各項民俗、藝文的表演；市民可以到這個全民共享空間歇息散步，體會一下邁向國際化都市的建築及藝術作品的展現。新北市行政大樓除作為行政中心外，更扮演救災及交通指揮樞紐的角色，全市災害應變中心及交通控制中心就設置在市府大樓9樓，由於交控中心的...,(02)29603456,,新北市,板橋區,中山路1段161號,382000000A,新北市政府觀光旅遊局,2022/8/30 上午 03:03:13,12800000
Attraction_376530000A_000072,Attraction,Zh_tw,後灣,後灣位於屏東縣車城鄉，北接國立海洋生物博物館，東臨龜山，西濱台灣海峽，隸屬墾丁國家公園的範圍。後灣沿岸為隆起珊瑚礁地形，自然擁有以礁岩為主體的潮間生態，是一處景觀優美的弧形海灣。 後灣深處海域因為強烈的侵蝕作用，因而造成各種珊瑚礁地形，譬如溶蝕溝，因為溝底平坦、溝壁陡直，所以形成海階地形，而且階與階的距離可達1公尺高。還有溶蝕坑洞，後灣海岸的坑洞範圍相當廣大，絕大部分的坑洞深度都超過30公分，有些甚至是好幾個坑洞洞壁被溶蝕後所集合而成的。這也說明了為何可以在岩岸看到一些侵蝕明顯、時而裸露的珊瑚礁石。 後灣原是一處僻靜的小漁港，因為電影《海角七號》的推波助瀾，許多海角迷想要尋找電影場景中，茂伯一行人聊天到天亮的海邊而聲名大噪，但後灣的悠閒氣息與美麗海灘，確實也不浪得虛名。在進入漁村之後，直往堤防的方向走，不久之後就會看見一座紅藍相間的后灣橋，這裡就是電影中，大家聊天散心的海邊了。 在後灣的海岸上，設有幾座木造觀景平台，站在平台上，優美的海灣曲線一覽無疑，加上眼前是一片風平浪靜的海面，的確能讓心情自然放鬆下來；想去撿撿石頭或踩踩海水，就順著沿岸的堤道走下去，順便還能欣賞到受海水侵蝕後的珊瑚礁孔洞；還有記得要到漁村裡走走看看，近距離感受後灣漁村悠閒自在的氣氛。,(08)8821001,,屏東縣,車城鄉,車城鄉 ,376530000A,屏東縣政府,2024/10/15 上午 06:37:49,12200000
Attraction_376440000A_000034,Attraction,Zh_tw,十三好市集,,0905369013,,新竹縣,竹北市,文興路一段123號,376440000A,新竹縣政府交通旅遊處,2025/4/29 上午 09:12:13,11500000
Attraction_376470000A_000548,Attraction,Zh_tw,彰化中興莊,"眷築夢想　綻放中興莊
　　建於民國39年，坐落八卦山腳下的中興莊眷村，第一代住戶大多是山東青島保安旅高芳先將軍的子弟兵及其眷屬，他們遠從山東青島遷台，來到中興莊落地生根，走過烽火歲月，更在此傳承威武不屈的民族精神。
　　彰化縣政府為了保存這段光輝歷史，致力推動文化資產，自98年開始著手調研中興莊的歷史軌跡，99年成功將中興莊登錄為彰化縣歷史建築，也是彰化目前唯一保留完整的眷村。101年獲得國防部選定為眷村文化保存區，110年修正登錄為聚落建築群，111年10月第1期廣場及環境整備工程完工後，彰化縣文化局以公益換租模式活化，將4棟建築6單元提供青年創業空間，並於112年1月正式開幕營運，結合周遭的景觀及在地產業特色，以嶄新樣貌和在地居民與訪客見面，預計114年完成第2期整區修復工程，未來期許讓眷村歷史持續綿延流長，再現彰化味。",(04)7250057,,彰化縣,彰化市,彰化縣彰化市中山路二段790巷,376470000A,彰化縣政府城市暨觀光發展處,2023/6/6 下午 04:23:54,10900000
Attraction_A15011200H_000158,Attraction,Zh_tw,南寶高爾夫球場,南寶高爾夫球場位於臺南市大內區頭社公廨旁，鄰近走馬瀨農場、曾文水庫、南元農場以及國立臺南藝術大學等景點，這裡的球道大多呈南北走向，以避免球友擊球時碰到正面逆光的情形。球場外圍原始樹林青鬱茂密，球道兩側則種滿桃花心木、樟樹等，景色宜人。,(06)5762546,,臺南市,大內區,頭社里136號,A15011200H,交通部觀光署西拉雅國家風景區管理處,2024/6/26 下午 04:39:31,10100000
Attraction_382000000A_110625,Attraction,Zh_tw,烏來風景區,綻紅櫻花暈染整個青翠山谷，是北部最佳的賞櫻之鄉,(02)26616355,,新北市,烏來區,烏來街45號之1(烏來遊客中心),382000000A,新北市政府觀光旅遊局,2022/12/5 上午 08:10:29,9980000
Attraction_395000000A_000595,Attraction,Zh_tw,南寶高爾夫俱樂部 ,由南寶集團所投資興建的南寶高爾夫俱樂部，位於台南市大內區。球場共有A、B、C區共二十七洞，球道大多呈南北走向，避免球友擊球時碰到正面逆光的情形。球場四周有溪流環繞，與外圍的原始樹林相映，景色宜人；球道地勢起伏，兩側種滿桃花心木、樟樹、台灣櫸木、南洋杉、蒲葵、梢楠、羊蹄甲、等樹林，加上造型各異的水塘、沙坑，是一處適合各個球技等級球友的擊球好去處。,(06)5763829,,臺南市,大內區,頭社里頭社136號,395000000A,臺南市政府,2024/1/9 下午 04:06:59,9930000
Attraction_379000000A_002273,Attraction,Zh_tw,臺北市政府,臺北市政府所在的市政大樓是信義計畫區的地標之一，座落於仁愛路尾端，若登上台北101俯瞰市政府，可以看見整棟建築呈「雙十」型態，而位於市政大樓裡面的台北探索館，有著豐富展示內容及導覽服務，是許多國內外遊客認識臺北的第一站。臺北市政府是臺北市的行政機關，成立於民國34年10月。於56年7月1日正式改制為直轄市，改制後臺北市長原為官派，至民國83年12月25日改為民選市長。自改制以後，隨市政建設急切需求，組織結構變遷，除裁撤、歸併不合時宜的機關(構)外，同時陸續成立許多機關、學校。目前市政府所轄組織，設有民政局、財政局、教育局、產業發展局、工務局、交通局、社會局、勞動局、警察局、衛生局、環境保護局、都市發展局、文化局、消防局、捷運工程局、臺北翡翠水庫管理局、觀光傳播局、地政局、兵役局、體育局、資訊局、法務局及青年局等23局；秘書處、主計處、人事處、政風處及公務人員訓練處等5處；以及研究發展考核委員會、都市計畫委員會、原住民族事務委員會及客家事務委員會等4委員會；另有臺北自來水事業處及臺北大眾捷運股份有限公司、工程總隊及動產質借處等4事業機構及12個區公所。(資料來源:臺北市政府網站),(02)27208889,,臺北市,信義區,,379000000A,臺北市政府,2024/8/28 上午 11:12:51,9550000
Attraction_387000000A_001741,Attraction,Zh_tw,第五市場,文學公園旁的老臺中味,(04)22279299,,臺中市,西區,大明街9號,387000000A,臺中市政府觀光旅遊局,2025/5/7 下午 06:01:09,8980000
Attraction_379000000A_000394,Attraction,Zh_tw,臺北賓館,建築風華走過百年歲月的臺北賓館，一直是臺灣政治的核心。它的前身是日據時期的「臺灣總督官邸」；臺灣光復之後，曾作為省主席官邸；1950年，改稱臺北賓館，是舉行國宴、招待外賓、黨政會議及文化活動的國家重要場所。1998年由內政部指定為國定古蹟。臺北賓館起造於1899年，由日本建築師宮尾麟、野村一郎設計；1911年改建工程經森山松之助設計，成為現今的樣貌；2002年封館進行臺灣光復後最大幅度的整修，至2006年5月竣工；隨著臺灣民主化的進程， 2006年7月4日臺北賓館已首次對一般民眾開放，空間解嚴的思維讓國人可以一窺臺北賓館百年的神秘面貌。臺北賓館的基地東西向長，成矩形狀，建築主體坐北朝南，為磚及石材、鋼筋混泥土構造之兩層樓建築物。受到日本於明治維新後引進的西方歷史樣式建築影響，臺北賓館有馬薩式斜頂、希臘山牆、羅馬柱式和華麗的巴洛克風格雕飾。四面留設寬廣的陽台，與東南亞的歐美殖民城市的官方建築相似。三樓東南隅有涼台，節慶時可觀賞遊行隊伍、眺望街景。歷史沿革臺北賓館在日治時期，除了作為總督宅邸以外，同時也作為行政辦公與迎賓社交之場所。而落成後的第一件大事，就是接待1901年10月來臺的北白川宮能久親王妃富子，此後這裡陸續接待了閑院宮載仁親王、久彌宮邦彥王、秩父宮雍仁親王、高松宮宣仁親王、昌德宮李王垠等皇室貴族，而其中最重要的便是1923年裕仁皇太子（即日後的昭和天皇）訪臺的接待活動。裕仁皇太子泊宿於總督官邸的期間，主要的活動空間在官邸的2樓，百官仕紳的拜謁儀式也都在2樓的大客室舉行，而皇太子來訪的第一天，總督曾安排其登上3樓的旋梯，在涼臺接受遊行民眾的歡呼。臺灣光復後，臺北賓館雖然不再是總督官邸，但仍然是政府會晤、款宴外賓的主要場所，歷任總統曾在臺北賓館1樓接見了無數的貴賓，其中又以1957年日本首相岸信介、1981年新加坡總理李光耀、2005年美國前總統柯林頓、2008年大陸海協會會長陳雲林等人最具代表性。此外，我國政府也在臺北賓館的宴會廳簽訂了許多重要的國際條約或協定，而最重要當屬1952年由外交部長葉公超與日本全權代表河田烈所簽署，關係臺灣主權地位甚鉅的「中日和約」；之後較為著名的，則是2009年5月14日由馬英九總統簽署的「公民及政治權利國際公約」及「經濟社會文化權利國際公約」兩項國際公約，象徵著我國在融入國際人權體系及拓展國際人權合作方面邁進了重要的一步。回顧這段臺北賓館走過的歲月，我們不難發現，臺北賓館的價值不單單只是因為其百年的歷史，它是一座巧妙結合東西方文化的建築，更見證了臺灣這一世紀來的風華變遷，無論就何種角度觀察，這裡的一磚一瓦、一草一木，都值得我們大家共同愛護及保存。,(02)23482999,,臺北市,中正區,,379000000A,臺北市政府,2024/8/30 下午 05:14:50,8510000
Attraction_379000000A_003163,Attraction,Zh_tw,臺鐵臺北車站,臺北車站（臺灣高鐵、臺北捷運稱為臺北車站）位於臺灣臺北市中正區，為臺灣鐵路管理局、臺灣高速鐵路、及臺北捷運三鐵共構的地下化鐵路車站，也是臺北捷運板南線、淡水信義線之交會車站，不僅是北臺灣首要的交通樞紐，也是臺灣建築規模與運量最大的鐵路車站，每日轉乘的旅客約50萬人次以上，總使用人次居於全球第25名。臺北車站於1891年7月5日設站，歷經多次遷移與改建後，現今站體為1989年9月2日啟用，臺鐵局本部也設於此地，隨著捷運、高鐵進駐之後，形成幅員廣闊的地下街區。車站周邊有商辦、補習班聚集的站前商圈，若再連結臺北轉運站、捷運北門站、機場捷運臺北站、華山特區等「臺北車站特定區」關聯設施，面積可達46.31公頃。另外臺北車站常被稱為「臺北火車站」，臺語則稱為「臺北火車頭」或「臺北車頭」，年輕族群則常簡稱為「北車」。,(02)21910096,,臺北市,中正區,,379000000A,臺北市政府,2024/9/10 下午 09:41:02,7860000
Attraction_376540000A_000360,Attraction,Zh_tw,臺東航空站,下次來到臺東航空站，多留些時間在這裡吧！曾獲選為國內最美航空站的臺東航空站，擁有有別於其它國內機場的設施以及展示，多元的服務和規劃讓人感受到機場同仁的貼心和熱情，讓機場不只是載著乘客往返各地的集散地，而是民眾爭相在此拍下留念照片的觀光勝地。,(089)361111,,臺東縣,臺東市,民航路1100號,376540000A,臺東縣政府交通及觀光發展處,2025/3/11 上午 10:18:00,7580000
Attraction_376530000A_000012,Attraction,Zh_tw,屏東西市場 ,"屏東西市場 華麗變身！攤商進駐搶先試賣！
屏東西市場是老屏東人的回憶，現在以全新面貌強勢回歸，攤商陸續進駐，幫大家搶先開箱！
這是屏東首座有空調的五星級綠建築市場，逛街買菜可以吹冷氣，攤位涵蓋在地生鮮、蔬果、熟食、生活百貨等日常所需，更有滿滿人情味，來西市場一次購足！
屏東西市場6/25起將試營運，7/16正式開幕，歡迎大家來逗熱鬧??",(08)7320625,,屏東縣,屏東市,和平路320號,376530000A,屏東縣政府,2024/10/15 上午 06:37:38,7240000
Attraction_387000000A_000400,Attraction,Zh_tw,一中街夜市＿一中商圈,位於中友百貨附近，與三民商圈連成一氣，附近有臺中科技大學、臺中一中、台灣體育運動大學等學校，學生人口眾多，小吃攤、飲食店林立，各種新潮流行資訊在這隨處可見、隨手可得。每到假日，人潮眾多，十分熱鬧！育才街上多是小吃攤，而服飾店多在小巷子中。各式新潮前衛的玩意都會在此先出現，若你是流行的追求者，一中夜市絕對不能錯過。,(04)22289111,,臺中市,北區,一中街,387000000A,臺中市政府觀光旅遊局,2025/5/7 下午 02:34:39,6520000
Attraction_376540000A_000300,Attraction,Zh_tw,加路蘭遊憩區,走在台11線157公里附近，加路蘭遊憩區就在眼前，這裡離小野柳風景區不遠，原為空軍建設志航基地機場時的廢棄土置場，經東海岸國家風景區管理處廢多次規劃整理後，以生態工法開發，目前已成為相當熱門的遊憩區，加上每年裝置藝術使得加路蘭遊憩區成為自然與藝術氣息兼備的海岸。,(089)281530,,臺東縣,臺東市,台11線157公里處,376540000A,臺東縣政府交通及觀光發展處,2025/3/14 上午 11:12:30,6430000
Attraction_376540000A_000468,Attraction,Zh_tw,臺東車站,要來臺東，坐火車是很棒的選擇，不論從南迴或是東部幹線過來，沿途的山海風景相當迷人，臺東車站經歷了多年的變更，從原本的卑南車站直到今日的臺東車站，都一直誠摯歡迎著前來遊玩的旅客、迎接著離開故鄉打拚的遊子們。,(089)229687,,臺東縣,臺東市,岩灣路101巷598號,376540000A,臺東縣政府交通及觀光發展處,2024/7/12 下午 05:31:09,6260000
Attraction_395000000A_000559,Attraction,Zh_tw,新化老街,新化老街從日治時期就是一個台南山區入口的重要政經中心，現金保留許多仿巴洛克式的老洋樓，曾獲全國歷史建築百景票選的第2名,(06)5905009,,臺南市,新化區,中正路336~441號,395000000A,臺南市政府,2024/1/9 下午 04:06:59,6210000
Attraction_A15011200H_000023,Attraction,Zh_tw,新化老街,走上新化老街，這條帶著濃厚巴洛克風格的特色老街，氣派古典的洋樓林立，讓人重溫新化的舊日風華。1921年在新化西邊街上出現了首棟的仿巴洛克樓房，即是今日中正路432號的林先生布行，此樓房集合了工藝技術及藝術概念，成了街上最搶眼的風景。之後，鄰里也隨之仿建，直到1937年，日本政府將整條街以造街名義改建成統一風格，至今新化老街依舊保存著古老建築的工藝之美。新化舊名「大目降」，在大目降時代，此街的生意往來活絡，可說是當地最為熱鬧的地方。光臨新化老街，除了欣賞老街建築的考究精緻外，更該走一趟大目降故事館，從人文角度更深入認識新化，裡頭還有許多旅遊資訊可供旅人參考。據說認識老街最直接的方式就是「吃」。漫步新化老街可別錯過街邊道地的古早味美食，樣樣都是在地人小時候的記憶。老建築、舊時光、好滋味、紀念館，...,(06)5905009,,臺南市,新化區,中正路336-441號,A15011200H,交通部觀光署西拉雅國家風景區管理處,2024/6/26 下午 04:38:46,6210000
Attraction_379000000A_001592,Attraction,Zh_tw,國史館,國史館位於總統府後方長沙街上，建築為融合西洋古典與現代風格的市定古蹟，早期為日治時期臺灣總督府交通局遞信部。國史館除定時導覽及團體預約導覽外，同時配合舉辦相關推廣教育事項，包括系列演講、文物專題演講等；另提供館藏數位化檔案，以供各界檢索應用。,(02)23161000,,臺北市,中正區,,379000000A,臺北市政府,2024/11/4 下午 05:30:07,5950000
Attraction_379000000A_000660,Attraction,Zh_tw,北投公園,"「北投」總是給人說不完的人文、傳說及故事，下了新北投捷運站，跟著裊裊的溫泉煙霧前行，前方滿是綠意的溫泉鄉美景，就是北投公園。北投公園由北投1、2、4、54、55號等都市計畫公園所組成，面積達6萬1,129平方公尺。首先映入眼簾的，是98年度完工的入口跳泉，每日固定時間隨著音樂，有著燈光及水泉飛舞，為北投這個具有豐富文化的老臺北地區，重新注入一股新生的活力，沿著光明路側，途經白千層及魯花樹等珍稀老樹，為即將滿百歲的北投公園見證他豐富的歷史，旅途中，也會經過由臺北市立圖書館首次建築的綠色圖書館，強調節能省碳，也為北投公園帶來書香氣息，門口的的噴水池更是電影取景之首選，沿著北投溪前進，世界上唯一以臺灣地名命名的「北投石」，即出產於此，雖然現在已不復見。越過小徑拾級而上，來到中山路側，除了北投露天溫泉浴池外，旁邊還有于右任先生提名之「梅庭」歷史建物，目前已由臺北市政府觀光傳播局規劃為梅庭遊客中心，以提供遊客最貼心的服務，還有聞名的溫泉博物館，日洋合一的木造窗櫺及紅磚建築體，似乎還瀰漫著濃濃硫磺的特有香味，感受日據時代建築之美感，周邊潺潺溪流及綠蔭搖曳的景緻，置身其中，像是回到舊時的悠悠時光裡。北投公園有說不完的老故事以及各式各樣動、植物群聚，周邊還有地熱谷等著名景點，不妨趁著假日，安排一趟洗滌身心的知性之旅，相信您一定滿載而歸。公園位置：北投公園一：臺北市中山路2號隔壁北投公園二：臺北市中山路4-1號北投公園三：臺北市中山路5-7號北投公園四：臺北市光明路227號對面北投公園五：臺北市光明路283號對面管理單位：陽明山公園管理所　聯絡電話：2883-2130",(02)28832130,,臺北市,北投區,,379000000A,臺北市政府,2024/11/4 下午 05:32:24,5820000
