Attraction_387000000A_000143,Attraction,Zh_tw,國立臺灣美術館,國立臺灣美術館隸屬文化部，是台灣唯一的國家級美術館，也是目前亞洲最大的美術館之一，地處於臺中市中心點，交通便利，館佔地約三公頃，於1988年開館使用。國立臺灣美術館周邊景點有國立自然科學博物館、美術園道商圈、草悟道等知名景點，特殊的藝術氛圍帶動附近的藝文與商業活動，形成充滿文藝氣息的生活圈與觀光遊憩區。,(04)23723552,,臺中市,西區,五權西路一段2號,387000000A,臺中市政府觀光旅遊局,2024/5/10 上午 10:46:24,214000
Attraction_387000000A_000044,Attraction,Zh_tw,大坑9號及9-1號步道,9號步道入口位於經補路一段383巷內，可由大坑地震公園旁之經補路轉入經補路一段383巷，可直行產業道路爬坡而上，連接6號步道及觀音亭。由經補路起算全程約1.7公里，來登山民眾可將車輛停放在經補庫停車場或地震公園旁停車場後，即可享受一段優質的登山之旅。大坑9-1步道路線緩和，輕鬆易行，步道頭尾都與經補路相接，自步道出口連接9號步道，再與10號步道形成環狀路線，約1.5小時可行走完畢，歡迎愛好登山健行的民眾前往登爬。,(04)22289111,58511.0,臺中市,北屯區,經補路一段383巷,387000000A,臺中市政府觀光旅遊局,2024/8/12 下午 05:01:50,214000
Attraction_379000000A_000296,Attraction,Zh_tw,台北天后宮,台北天后宮，俗稱「西門町媽祖廟」，主祀天上聖母媽祖，現位於臺灣臺北市萬華區成都路上，於1746年時由郊商捐建（當時名為新興宮），與艋舺龍山寺和艋舺祖師廟並稱臺灣清領時期艋舺3大寺廟。1943年因西園路馬路拓寬，所以遭到拆除，神像寄於龍山寺。1948年，信徒將暫時寄人籬下的天上聖母神像從龍山寺迎接出來，改供奉在成都路北側近西寧南路口交叉口的「弘法寺」，原先是日本時期日本人所建立的弘法寺，戰後失火燒毀後，新興宮弘法寺的正殿改建更名為「台灣省天后宮」，不久又改稱「台北天后宮」，真是一段曲折的歷史。媽祖被視為海上的守護神。早期臺灣有賴海洋以維生，又有東南沿海一帶渡海來臺墾拓，碼頭處即為群眾所居，寺廟亦常築於河巷，是以各地港口多建有媽祖廟，其廟口朝向河對岸的山頭，希望保佑每個討海人及渡海移民安全。寺廟內入口處龍邊宮置有古鐘一座，由鐘上所鑄字樣可以得知可見清朝建廟之時其名即為「新興宮」，鑄造年代為1792年（乾隆57年），鑄造地為江蘇無錫。入口處虎邊則置放一座「八仙香爐行宮神龕，八仙蓮花木燭」，原為新興宮神龕，為1820年唐山師傅刻造。從1973年以來，日本高野山金剛峰寺及東京別院每年10月到12月間都輪流派遣高僧到台北天后宮，舉行朝聖禮佛法會。台北天后宮的主神是媽祖，陪神是弘法大師，全臺只有台北天后宮有供奉弘法大師，因此往往吸引了許多日本觀光客專程遠道前來參拜。,(02)23310421,,臺北市,萬華區,,379000000A,臺北市政府,2024/11/4 下午 05:35:57,214000
Attraction_395000000A_000671,Attraction,Zh_tw,安平古堡,臺灣城又稱王城、赤嵌城、安平城。原為荷蘭人所建，早期的漢人稱荷蘭人為紅毛，所以把這座巍峨的域稱為紅毛城。日治時期改建後，稱為安平古堡，沿用至今。熱蘭遮城興建於1634年。 完工之時，城分內外兩城，內城形方，共築三層，下層位於地面下，作為倉庫，地上有兩層，上層四角有稜堡，兩角之中間有北、東、南三門，北門門額上刻有Ｔ‘ＣＡＳＴＥＥＬ　ＺＥＥＬＤＩＡ　ＧＥＢＯＵＷＥＤ　ＡＮＮＯ　１６３４　〔熱蘭遮城建於一六三四年〕字樣。下層四角亦有稜堡，台基各邊中央各有半圓堡，半圓形中央各有井一口。 北側有小門及樓梯，可下,(06)2267348,,臺南市,安平區,國勝路82號,395000000A,臺南市政府,2025/2/8 上午 11:12:24,214000
Attraction_379000000A_000381,Attraction,Zh_tw,小南門_重熙門,臺北城是清領時期最後所建城池之一。當年的城牆如今皆已傾圮，只留下幾座城門遺跡，成為歷史的見證。臺北城的城牆寬4公尺、高5公尺，圍繞約4公里，是座非常堅固的城池。一般的中式城牆都有4個門，可是臺北城有5個門，據說是當時的板橋富商林本源家族為了方便出入，特別捐贈所建造的。雖然這樣的傳說尚未受到證實，但小南門在中式的城池建築中，的確是個非常特別的例子。可惜的是，雖然它和東門、南門一起逃過了日本人的摧毀，但卻在國民政府來臺後，被改建成中國北方宮殿式的城樓，只有底部的城座仍然保持當年原始的樣貌，繼續守護著臺北。,(02)27208889,,臺北市,中正區,,379000000A,臺北市政府,2022/12/5 下午 03:50:35,213000
Attraction_376440000A_000537,Attraction,Zh_tw,松湖園 ,,0988135978,,新竹縣,湖口鄉,和興路755巷32弄31號,376440000A,新竹縣政府交通旅遊處,2025/4/28 上午 09:26:49,211000
Attraction_382000000A_110037,Attraction,Zh_tw,十分老街,體驗「火車門前過」的新奇，與在鐵軌旁逛街的樂趣,(02)24951510,,新北市,平溪區,十分老街,382000000A,新北市政府觀光旅遊局,2022/12/5 上午 08:08:59,209000
Attraction_397000000A_000056,Attraction,Zh_tw,錫安山,位於那瑪夏區叢山俊嶺中的鍚安山，原本是一座荒煙漫蕪的山嶺，後來由一群虔誠的新約教教徒們在此開墾經營，猶如世外桃源。,(07)6701218,,高雄市,那瑪夏區,錫安山,397000000A,高雄市政府觀光局,2022/11/28 下午 03:15:46,209000
Attraction_371020000A_001623,Attraction,Zh_tw,金門大學,金門大學前身是1997年國立高雄科學技術學院附設專科部金門分部。校本部位於金門縣金寧鄉，佔地約14公頃，目前共有4個學院、17個學系、12個研究所碩士班、2個碩士在職專班。招收學制設有四年制大學部、進修部、碩士班、碩士在職專班等。,(08)2313300,,金門縣,金寧鄉,大學路1號,371020000A,金門縣政府觀光處,2025/4/8 上午 05:26:34,208000
Attraction_A15010600H_000079,Attraction,Zh_tw,埔里遊客中心,位於國道6號愛蘭交流道下的台14線道路旁的日月潭埔里遊客中心，已取得綠建築標章，並以歐式城堡的美麗姿態提供遊客便利、友善的觀光遊憩諮詢服務，已成為遊客進入日月潭、埔里或清境前的前哨旅遊服務點。服務中心提供的i系統服務台、好行轉運、智慧旅遊、在地產業等資訊與服務設施，除了為來往的國內外遊客提供完善、便利且優質的觀光遊憩諮詢及旅運服務之外，同時也將扮演連結日月潭美景與埔里生態產業間的重要角色。遊客中心旁的Labello美妍蔬果冰淇淋店，以創新思維設置『青農小鋪』展售在地青農的無毒自然農產品，同時，將青農蔬果結合冰淇淋，開發出來好吃又健康的蔬果冰淇淋，成為遊客旅途中最佳嚐鮮新選擇。現在經過埔里遊客中心時，會發現２樓多了人文氣息濃厚的書櫃彩繪，亮眼的建築外觀勢為台14線的美麗新焦點，甚至在花圃中驚喜發現青農苦瓜與玉米特色造型唷!&nbsp;,(049)2916060,,南投縣,埔里鎮,中山路四段191號,A15010600H,交通部觀光署日月潭國家風景區管理處,2025/5/12 下午 12:05:05,208000
Attraction_A15010500H_002773,Attraction,Zh_tw,一線天,陡峭絕壁天縫聆濤 一線天位在東引島東側天王澳的左側岬角，為一處聳峭的海蝕溝地形，兩岩壁垂直相鄰至相接，上窄下寬，上接天、下通海，每當潮水灌入，底部海浪拍擊石塊，如萬馬奔騰之音，壯闊迴繞於岩壁間；在兩座山崖之中築有坑道，並建有一座水泥橋相連，橋面距海面僅數十公尺，卻有百公尺以上之氣勢。 岩壁上題有「天縫聆濤」四個大字，絕妙說出這個景點的動人之處，是1972年時任參謀總長的賴名湯將軍蒞臨東引巡視時所題，靜塑於高聳岩壁上，頗有遠戍前線的孤絕之感。 過去，一線天是軍事管制區，但現今一線天已完全開放，不需預約登記就可以自由進入參觀；拾階步行向下，抵達戰備壕溝的終點，「一線天」景致於眼前展現，想聽浪濤聲，隨時都可以前往。 備註：提醒遊客小心上下階梯，注意濕滑及落石，開放時間一過即關閉電源，籲請遊客配合及注意旅遊安全。 ,(0836)77267,,連江縣,東引鄉,連江縣東引鄉,A15010500H,交通部觀光署馬祖國家風景區管理處,2023/8/11 下午 07:23:02,208000
Attraction_395000000A_000739,Attraction,Zh_tw,原林百貨,台灣現存最古老的西式百貨，2014 年6 月復修開放，並定位為文創百貨，成為令人注目的台南文化新地標。商場內的空間規劃與商品、咖啡廳、美食等各方面，都融合了在地文化創意與歷史記憶的特色。,(06)2213000,,臺南市,中西區,忠義路二段63號,395000000A,臺南市政府,2024/1/9 下午 04:06:59,208000
Attraction_395000000A_001358,Attraction,Zh_tw,二王廟,二王廟為永康地區歷史悠久的古廟，建於西元1681年。當時主祀在此墜馬亡故的延平王鄭經，隨著歷史信仰演變，現則主祀關聖帝君，但仍供奉鄭府二王爺。此處廟宇傳說頗多，相傳清末時廟所在的二王崙周邊都是高聳的榕樹，人煙稀少，往來通行只有一旁的小徑。當時盜賊橫行，囂張預告將搶劫聚落，當地居民嚇得向二王爺祈求平安，沒想到當天盜賊們來到後卻迷失在榕樹林裡，遍尋不著通往村落的小徑，居民嘖嘖稱奇，認為是二王的神蹟，也奠定二王廟在此地信仰的重要性。,(06)2333215,,臺南市,永康區,永二街395號,395000000A,臺南市政府,2024/10/25 下午 02:02:54,208000
Attraction_376530000A_000025,Attraction,Zh_tw,屏東公園共融遊戲場,"屏東公園已經有121年歷史，是屏東人的共同回憶，縣府不斷讓百年公園注入新亮點，這次打造6公尺高的紅尾伯勞主題溜滑梯，3層難度層層突破、8大路徑自由探索，孩子更能爬上最頂層眼睛遠望，體驗從鳥的視野俯看大自然。
遊戲場還有沙坑、盪鞦韆、體健設施等，是大小朋友都能玩的全齡遊戲場。",(08)7320415,,屏東縣,屏東市,公園路,376530000A,屏東縣政府,2024/10/15 上午 06:37:40,207000
Attraction_376580000A_000069,Attraction,Zh_tw,新竹金山寺,金山寺奉祀觀音佛祖，為林合成墾號招佃拓墾設隘防番之際，墾民奉祀為保護神，1853年由墾首郭家獻地充基，結茅祀佛，名曰香蓮庵，1857年正式建寺，由於該地有清泉圍繞，許多騷客到此品茗，謂之靈泉試茗，而改名「靈泉寺」。1889年時，由林汝梅捐資重建廟宇稱為「長清禪寺」，後以其地在金山面乃改稱為金山寺。金山寺為清代中期的建築，現存的格局為單進三開間帶左右護龍之合院形寺廟，整體風格樸實，斗子砌磚牆及磚砌結構不但特殊，更增添古樸的美感，寺中所用石材及雕工皆頗講究，尤其石獅之造型生動，堪稱佳作，寺前的供食台(佈施台)，為1860年之作品，古拙蒼勁之韻味，極具歷史價值。,(03)5780566,,新竹市,東區,金山路201號,376580000A,新竹市政府,2023/4/28 下午 04:00:00,206000
Attraction_387000000A_000263,Attraction,Zh_tw,繼光街商圈,繼光街是屬於臺中市早期發展的商業型街道，該地區在日據時代稱之為「榮町」。在臺灣光復以前，以布店、飲食店、錶店及雜貨店等民生商業為主；日據時代至光復初期，可說是全臺中市最熱鬧的街道之一。 臺中市繼光街原是臺中市中區商業區的主題性商業街道之一，由繼光街、綠川西街、臺灣大道、及其相鄰之自由路商圈而形成的商業性活動街廓。目前已完成繼光行人徒步區造街計畫，其主要目標為串連繼光街周圍之火車站、中山公園、電子街及綠川西東街等，延續嶄新的造街風貌；針對部分動線擁擠、街道結構複雜的情況，進行整體環境優化與街區整合，提升逛街舒適度與商業吸引力。繼光街是當時最繁華的商圈，也是老一代臺中人的回憶；隨著時代的斗轉星移，演變成多元化的經營，展現商圈旺盛生命力。另一項特色，就是美食，品嚐不同風味佳餚，一次滿足你的味蕾，來...,(04)22289111,,臺中市,中區,繼光街、臺灣大道一段西側至民權路,387000000A,臺中市政府觀光旅遊局,2025/5/6 下午 07:11:08,206000
Attraction_376430000A_001404,Attraction,Zh_tw,桃園市土地公文化館,來瞧瞧威風凜然的神將每一筆畫有多細緻、古早農村廟口看戲是大人小孩都愛的樂趣…與土地公信仰密不可分的鄉土文化，帶你一探究竟。,(03)3366860,,桃園市,桃園區,三民路一段100號,376430000A,桃園市政府觀光旅遊局,2025/3/16 上午 01:31:09,206000
Attraction_371020000A_000508,Attraction,Zh_tw,慈湖,如果請問金門人欣賞落日的好去處，慈湖絕對能榮登在地首選！慈湖位在金寧鄉，1969年為了戰略考量而興建的慈堤，隔在堤外的是海域，在堤防內的部份就是現在的慈湖了，後來再增建了觀景平台，讓慈湖美景更能受到外來遊客的歡迎。傍晚時分，橘紅色的夕陽從天邊緩緩落下，彩霞映著對岸廈門的遠景，也揮灑在過去反登陸的「軌條砦」上，形成一幕慈湖特有的景致。每年10至3月，前來金門過冬的候鳥便會聚集在慈湖周圍，尤其以鸕鶿最多，將近三、四千隻的鳥群，依人字排列飛行歸巢，其壯觀的景象為金門贏得不少喝采！,(08)2313100,,金門縣,金寧鄉,慈湖,371020000A,金門縣政府觀光處,2025/5/8 上午 01:28:57,205000
Attraction_376490000A_000745,Attraction,Zh_tw,雲林二手玩具屋,"為兒童設計的童話世界
原為公正派出所，翻修後成為兒童遊戲空間。從入口大門到空間感、採光，處處可見巧思。募自各地的玩具豐富性高且分門別類收納，讓孩童在遊戲之餘學習收納和環保之觀念。",(05)5338951,,雲林縣,斗六市,斗六市中正路191號,376490000A,雲林縣政府,2023/7/14 下午 03:21:41,205000
Attraction_395000000A_000773,Attraction,Zh_tw,台南文化創意產業園區,日政府於西元1901年（明治34年）設臺灣總督府專賣局。此建物應係同年間所建，為ㄇ型紅磚建構，其左右勾轉處頂突出扇形并有三線條雕繪，與臺北專賣局建構相同。 日治時期專賣廳紅磚建築，ㄇ型紅磚建構，其左右勾轉處頂突出扇形并有三線條雕繪，與台北專賣局建構相同。門窗格局，與原台南地方法院相仿。目前保存良好，仍供原物使用中。後方有日式庭園，並有「昌南土」石碑及石獅、石板，一併涵蓋在範圍內。,(06)2222681,,臺南市,東區,北門路二段16號,395000000A,臺南市政府,2024/1/9 下午 04:06:59,204000
Attraction_376580000A_000007,Attraction,Zh_tw,新竹都城隍廟,新竹都城隍廟位於新竹市北區中山路上，列屬市定古蹟，創建於1748年，由淡水同知曾曰瑛倡議興建，1875年，淡新分治，設台北府，但府治仍在新竹，故城隍爺晉升為府城隍－威靈公，香火鼎盛，有「新竹城隍爺，北港媽祖婆」的稱譽。其廟宇規模在當時是全台灣之最，專門掌管陰間與陽間賞罰善惡的神明為城隍，所以城隍廟的佈置猶如古代的衙門；新竹都城隍廟廟埕的巿集小吃攤，成為新竹特色之一。新竹都城隍廟歷經多次翻修，以三川殿及三疊式屋頂最具特色，懸掛在屋樑上的大鐵算盤，據傳是城隍用來計算人世罪惡的，所以兩旁的對聯寫著『世事何須多計較，神天自有大乘除』；新竹都城隍廟門前的石獅及其他雕飾均有藝術價值，龍柱是北台名師辛阿救的作品，雕工細膩生動，進入大門上方的八卦藻井，為泉州惠安大木匠師王益順之作，十分具有歷史意義的作品。新竹都城隍廟每年元宵節辦理元宵活動，推展傳統民俗藝術。農曆七月的迎城隍活動更是當地的盛事，每年從七月初一開始至八月初一東門市場的「東門普」收尾才算結束；七月十五中元節當日是活動的最高潮，由城隍爺本尊出巡，賑濟孤魂野鬼，由於出巡隊伍長達數公里，整個新竹市為之沸騰；至農曆十一月二十九曰城隍爺生日時，新竹都城隍廟內更是湧入大量信徒，人山人海，熱鬧非凡。,(03)5223666,,新竹市,北區,中山路75號,376580000A,新竹市政府,2023/4/28 下午 04:00:00,204000
Attraction_395000000A_004277,Attraction,Zh_tw,樹谷農場,樹谷農場(前身為奇美善化農場園)就位在樹谷生活科學館旁，農場內規劃有小太陽廣場讓遊客可在廣大草皮上體驗推牧草捲的樂趣；小動物餵食區是親子的最愛，讓孩子近距離接觸可愛小動物，落實生命教育；農業區可讓遊客體驗一日農夫的樂趣；烤肉區跟烘焙坊則成為享受親子相處時光的最佳場域。此外，農場也協助原住民發展在地紅藜產業，透過示範教學場域的種植與介紹，讓更多人認識原民部落的作物。,(06)5894800,,臺南市,新市區,中心東路12號,395000000A,臺南市政府,2024/1/9 下午 04:06:59,204000
Attraction_376450000A_000162,Attraction,Zh_tw,頭份後花園,在頭份市東北隅老崎紅土丘陵台地上，深隱著一片尚未過度開發的淨土；這裏，有茶園成壟、楓香林蔭，有松濤低吟、相思夾道，還有休憩步道連結各具風情的自然美景，沿途蟬鳴鳥叫，合奏大自然的樂章。夏天時油桐花似白雪般浪漫地舖滿一地，隨著不同季節，分別是相思黃花、柚花、梨花上場，陪伴遊客探訪步道，繽紛嬌容加上沁人香味，總是讓遊客們驚艷不已。這片遺世獨立的樂土，我們稱它為「頭份後花園」。 來到頭份後花園，第一站一定要來走走「老崎休憩步道」，這是老崎步道整修後的新風貌，相關工程均維持原有地形山勢，以自然生態工法興築，因此美觀又不失古樸。步道全長約四公里，分別於宣化堂、錦春農場、怡明茶園、日新茶園四處入口設有停車場，遊客可依時間和體力選擇短程往返或O型環繞式健行，沿途松林石階步道、楓香紅土步道，枕木扶桑步道，相思紅土步道各展風情。 頭份以生產「椪風茶」出名，因此後花園內茶園處處，每家茶莊前皆豎立著一塊「頭份後花園」的石碑，告訴您已經置身在這充滿田園之趣的樂土中。「椪風茶」又稱「東方美人茶」，獨特風味深受飲茶人士喜愛，在登山健身或是散步林間後，不妨悠閒坐下來喝杯好茶，許家古厝的客家三合院、怡明茶園的紅磚茶坊、悠悠小靜的唐風庭園茶坊以及錦春農場，皆滿盈濃郁的人文氣息氛圍，正符合品茗中國茶該有的恬適情懷。 ,(037)663038,,苗栗縣,頭份市,頭份後花園,376450000A,苗栗縣政府國際文化觀光局,2025/5/12 下午 12:00:05,203000
Attraction_376440000A_000353,Attraction,Zh_tw,竹北通德堂,,(03)5515919,,新竹縣,竹北市,東興路一段693巷31號,376440000A,新竹縣政府交通旅遊處,2025/4/29 上午 09:15:12,203000
Attraction_A15010800H_000183,Attraction,Zh_tw,荷蘭水,傳說鄭成功擊退荷人後。有兩位荷蘭士兵流亡到此，準備逃往東海岸。可是鄭成功的士兵一路在後追捕，他們途經此處時非常疲憊，於是取用這裡的山泉水，結果體力突然間恢復，於是繼續往東逃亡，擺脫了追殺者。後來的人因而取名荷蘭水。地點在今日古阿娜瀑布，從新美村開車約20分鐘，再走1個多小時山路。,(05)2593900,,嘉義縣,阿里山鄉,,A15010800H,交通部觀光署阿里山國家風景區管理處,2025/4/28 下午 05:00:33,203000
Attraction_387000000A_000073,Attraction,Zh_tw,東協廣場,東協廣場（舊稱第一廣場），鄰近台中火車站，在綠川西街上，樓高13層，是一間由臺灣大道一段、繼光街、成功路及綠川西街包圍的綜合性休閒娛樂廣場。位於站臺中車站前商圈，內規劃有地下停車場、精品服飾用品店、美食街、電影院（第一影城）、KTV、電動遊樂場、撞球俱樂部、保齡球館、溜冰場、民歌西餐廳等等，多為青少年與移工休閒去處。鄰近於臺中車站、臺中公園、臺中州廳等，因東南亞異國商店聚集，現有「台中小東南亞」之稱號。,(04)22289111,,臺中市,中區,綠川西街135號,387000000A,臺中市政府觀光旅遊局,2025/5/5 上午 09:52:23,203000
Attraction_397000000A_000634,Attraction,Zh_tw,三鳳宮,初建於清朝康熙年間，至今已有三百餘年的歷史，為昔日三塊厝住民的守護神，祭祀主神為中壇元帥哪吒三太子,(07)2871851,,高雄市,三民區,河北二路134號,397000000A,高雄市政府觀光局,2024/8/30 下午 04:09:26,202000
Attraction_387000000A_000368,Attraction,Zh_tw,七分窯,七分窯，是新社區崑山村中一處推廣水墨畫、陶瓷刻畫藝術的地方，也是台灣陶瓷刻畫學會會址，想嘗試捏陶、拉坯或陶刻，在這裡可以一次滿足。窯名「七分」，三分那裡去？主人張笠夫、李春美夫婦說：「震災前是醉了，但災後卻碎了。」不過，震災雖然震毀了作品，卻震不掉兩人對藝術創作與推展的執著，走出震災陰霾，從零開始，重新創作出一件件象徵希望的陶藝作品。九二一震災幾乎毀了「七分窯」多年來的收藏與創作，心疼無濟於事，張笠夫、李春美夫妻與台灣陶瓷刻畫學會的會員，災後十天就一邊整理受創的場地、一邊動手創作陶刻，成為災區重建藝術創作的範例。隱身在大自然山林之中的「七分窯」，可以玩陶、也可以賞畫，在這裡，還能感受到旺盛的生命力，這正是旅客的附加收穫。,(04)25820717,,臺中市,新社區,崑山里崑南街七分小巷1號,387000000A,臺中市政府觀光旅遊局,2025/5/7 下午 03:47:34,202000
Attraction_376490000A_001069,Attraction,Zh_tw,黑森林自行車道,原為農用牛車道，於2012年開闢為自行車道，兩旁遍植防風植物木麻黃，可以在陰涼樹蔭下舒服的騎乘自行車。,(05)5522000,,雲林縣,四湖鄉,654雲林縣四湖鄉海清路93號2,376490000A,雲林縣政府,2022/12/1 下午 05:22:01,202000
Attraction_376600000A_000013,Attraction,Zh_tw,二二八紀念碑,嘉義市是首先突破政治禁忌，建立國內第一座【二二八紀念碑】的地方。發生於西元1947年的二二八事件是一件令人痛心的歷史悲劇，當時中央及台灣省政府尚視二二八事件為禁忌，百般阻撓此一建碑行動，但在當時長張博雅及民眾堅持下，終於在一九八九年建碑在嘉義，成為國內第一座【二二八紀念碑】。,(05)2294593,,嘉義市,東區,大雅路二段695號,376600000A,嘉義市政府,2021/7/20 下午 03:29:42,200000
Attraction_A15010400H_000238,Attraction,Zh_tw,白砂灣,從關山南下上水右轉約2公里處就到了白砂灣，白砂灣位於貓鼻頭的西北海岸，原是一處漁港，當地也稱「白砂港」，白砂灣一帶屬於珊瑚礁沿岸，但是此處卻擁有一條約500公尺長的純白潔淨沙灘，細白的砂粒其組成為貝殼與珊瑚的碎屑所組成，白砂灣的東側有台地做為屏障，阻擋了東北季風，因此冬天時此處仍是風平浪靜，全年度皆適合從事各類的海洋遊憩活動。建議您可於沒有光害的夜晚，躺在沙灘上仰望天空數星星，別有一番浪漫的度假風情。,(08)8861321,,屏東縣,恆春鎮,白砂灣,A15010400H,交通部觀光署大鵬灣國家風景區管理處,2025/5/12 下午 12:15:05,200000
Attraction_395000000A_000784,Attraction,Zh_tw,集福宮,集福宮原名「集福祠」，與普濟殿、金安宮、媽祖樓同屬四聯境。清乾隆元年（西元1763年），創建於新港墘港邊，由黃姓、王姓、劉姓等碼頭工人，自故鄉泉州晉江縣南門外二十四都桃源塘後鄉集福祠，迎奉玄天上帝等神祇來台，做為船筏、碼頭工人之保護神，供境眾焚香膜拜；初為小廟，後於道光二年（西元1822年）修建老古石街渡口之泊岸及街路時，由黃資盛、黃元貢、黃元問等董事發起募捐，得銀壹仟大元首遷建現址，並更名為集福宮。（資料來自台南生活美學館）,(06)2234859,,臺南市,中西區,信義街38號,395000000A,臺南市政府,2024/1/9 下午 04:06:59,200000
Attraction_376430000A_001431,Attraction,Zh_tw,桃園市兒童美術館(八德館),館內收藏破萬本的兒童讀物，每月並舉辦多場親子藝文活動，觸動孩童的想像力與好奇心，讓美學教育從興趣當中轉為生活的一部分。,(03)2868668,,桃園市,八德區,介壽路一段728號5、6樓,376430000A,桃園市政府觀光旅遊局,2024/6/19 下午 04:27:52,200000
