Attraction_376490000A_000565,Attraction,Zh_tw,土庫故事館,土庫鎮公所舊宿舍，是位於臺灣雲林縣土庫鎮越港里的日式宿舍，為該鎮第一間雲林縣歷史建築，以「土庫故事屋」之名作展覽活化。,(05)7505005,,雲林縣,土庫鎮,雲林縣土庫鎮成功路59號,376490000A,雲林縣政府,2023/7/14 下午 02:11:18,371000
Attraction_376440000A_000299,Attraction,Zh_tw,新豐鄉農會,,(03)5576369,58.0,新竹縣,新豐鄉,新庄路293號,376440000A,新竹縣政府交通旅遊處,2025/4/28 上午 09:32:22,371000
Attraction_395000000A_000728,Attraction,Zh_tw,安平蚵灰窯文化館,即日起進行展示更新施作工程施工期間預計至113年12月15日暫時不對外開放詳細資訊請參閱 官方資訊蚵灰窯曾經是安平地區很重要的建材製造場所，也是目前台灣僅存唯一的蚵灰窯，從17世紀開始蚵灰便是以海為生的安平人必備的造船材料之一，後來延伸加入糖水、糯米汁成為蓋房的磚瓦黏合使用，現今雖然已不再使用這些古法建材，但仍舊保留了安平燒製蚵殼成為蚵灰的重要遺址，走進蚵灰窯會看見被愛玉子藤蔓覆蓋住的紅磚牆面，內部就是一座相當大的窯坑，內部直徑約4公尺，高度約為2公尺，窯體牆面最薄的地方還有1公尺厚，是難得一見的燒窯建築。文化館區域內詳細敘述著蚵的成長過程及生態，蚵灰的製作過程，蚵灰的應用，讓遊客可以很清楚的認識這古早的技藝，雖然現在蚵灰被新的工業建材取代，已經走進歷史不再使用，但幸好有蚵灰窯文化館傳承，讓...,(06)2286836,,臺南市,安平區,安北路110-1號,395000000A,臺南市政府,2024/10/14 下午 02:41:39,369000
Attraction_A15010500H_002765,Attraction,Zh_tw,東引遊客中心,到訪東引的第一站首選 沿著中柱港邊的中正路行經白馬尊王廟，不久便來到東引遊客中心。2003年興建完成的東引遊客中心位在中柱港南側山頭、南橋直升機場下方，距離兩處都不遠；不同於其他遊客中心的閩東風格建築，東引遊客中心矗立在山頭，為了防止強風侵襲而做伏低設計，從中柱港抬頭便可望見，做為導覽遊客的目標物十分稱職。 遊客中心一樓設有旅遊服務中心及販賣區，二樓兼具了展示功能，以燈塔、燕鷗為意向塑造的休息區，讓遊客可以在第一時間了解東引豐富的生態景觀，初來乍到，逛一趟絕對大有收穫。 由於東引的觀光資源豐富，舉凡名勝古蹟、海蝕地景、戰地風貌、原生種植物等，均值得一探究竟，遊客不妨將遊客中心作為到訪東引的第一站，觀賞簡介影片、索取摺頁、或是諮詢旅遊資訊，為接下來的旅程動線作準備。 ,(0836)77267,,連江縣,東引鄉,連江縣東引鄉樂華村160-1號,A15010500H,交通部觀光署馬祖國家風景區管理處,2023/8/25 下午 06:00:29,368000
Attraction_376470000A_000187,Attraction,Zh_tw,鹿港第一市場,第一市場是聚集傳統小吃的本營，包托美食有蚵仔煎、鴨肉羹、水晶餃、麵線糊、蝦丸、芋丸、肉丸、生炒五味、龍山肉羹、豬血麵線等等。只要一佰元便能吃上三種以上的小吃。,(04)7772006,,彰化縣,鹿港鎮,彰化縣鹿港鎮民族路,376470000A,彰化縣政府城市暨觀光發展處,2017/8/31 下午 02:32:19,365000
Attraction_376490000A_000242,Attraction,Zh_tw,斗南車站,"日治最後一驛
斗南車站設於明治36年，稱為他里霧驛，二戰末期改建為磚造站房建築，是為日治台灣改建的最後一個火車站，早年虎尾糖廠所產的糖包均透過糖鐵轉運至斗南，再經縱貫線配送至港口外銷。",(05)5972039,,雲林縣,斗南鎮,雲林縣斗南鎮南昌里中山路2號,376490000A,雲林縣政府,2023/7/14 上午 08:54:04,363000
Attraction_379000000A_000276,Attraction,Zh_tw,行天宮,行天宮位於中山區民權東路和松江路口，是北臺灣參訪香客最多的廟宇，一天進出人數可達萬人之多。行天宮恭奉南天文衡聖帝關恩主羽為主神、配祀南宮孚佑帝君呂恩主洞賓、九天司命真君張恩主單、先天豁落靈官王恩主善、精忠武穆王岳恩主飛、關聖太子平、周恩師倉，及儒釋道三教聖神仙佛。自落成以來，之所以會成為大臺北地區，甚至是整個北臺灣參訪人數最多的廟宇，除了信仰普遍受到民眾接受外，還有一些特色包括：不設功德箱、不供拜牲禮、不焚化金紙、不收受金牌、不演戲酬神、不設乩扶鸞、不對外募捐及禁止商業行為。廟宇地點位於市中心，且有寬敞的廟埕，並率先成立宗教性的財團法人機構，確立其社會公益的屬性。行天宮除了包含臺北本宮與三峽、北投兩間分宮在內的宗教事業，以及成立於1995年的「財團法人行天宮文教發展促進基金會」之外，還設有兩座附設圖書館(分別位於臺北市中心與北投)以及位於三峽的恩主公醫院，其公益性可見一般，使得宗教不只撫平民眾內心，也實質的助益了民眾的日常生活。,(02)25027924,,臺北市,中山區,,379000000A,臺北市政府,2024/11/4 下午 05:35:30,361000
Attraction_397000000A_000572,Attraction,Zh_tw,高雄文學館,高雄文學館建築本身為一棟二層樓古典建築，緊鄰聞名遐邇的「城市光廊」。是一棟兼具文學創作與文化休閒功能的多功能優質文學閱讀空間，讓民眾能更親近文學,(07)2611706,,高雄市,前金區,民生二路39號,397000000A,高雄市政府觀光局,2023/6/21 下午 02:46:26,360000
Attraction_A15010600H_000199,Attraction,Zh_tw,二坪山,位於水里鄉鉅工村，沿途山景宜人秀麗，更可在山上居高臨下，眺望水里市區景觀。已逾30年以上歷史的二坪枝仔冰，是由台電所屬發電廠福利社所生產，因水質純淨，因此這裡所製成的冰，吃起來別有一番滋味，故成為附近小學遠足踏青及各地遊客休憩品嘗古早味枝仔冰的最佳去處。,(049)2775465,,南投縣,水里鄉,二坪路41號,A15010600H,交通部觀光署日月潭國家風景區管理處,2025/5/12 下午 12:05:05,358000
Attraction_395000000A_000866,Attraction,Zh_tw,臺南市客家文化會館,新穎的會館建築在西元2010年落成啟用，來到門口看見暖色系木質招牌及花紋燈籠，就可感受到濃濃的客家風格，會館內紙傘與紅燈籠的布置更將客家風情呈現於此。裡面陳列許多客家文化相關的生活用品與農家器具，對於客家的人文歷史、手工藝、美食、建築等等，都有詳盡的介紹。其中客家信仰的部分提到敬天法祖，為客家人基本的信仰觀念，其源於古老傳統華人文化。在此可深刻體驗客家族群好客及勤儉的優良傳統，讓各地的旅人更能理解客家文化。,(06)2220324,,臺南市,南區,夏林路4號,395000000A,臺南市政府,2024/1/9 下午 04:06:59,358000
Attraction_395000000A_001201,Attraction,Zh_tw,東山服務區,東山服務區位於國道3號，是全台最大占地最大的高速公路休息站，以東山大榕樹為主軸，將森林與樹的元素融入，搭配戶外的原生植物園、百年榕樹、寵物公園等，重新打造帶有森林系風格的服務區，並設有美食廣場、服務台、無障礙廁所、24小時開放的哺集乳室、駕駛人休息室、車輛充電站等設施，提供來往的車輛旅客休息的地方。,(06)6230147,,臺南市,東山區,枋子林74-6號,395000000A,臺南市政府,2024/1/9 下午 04:06:59,357000
Attraction_395000000A_005995,Attraction,Zh_tw,臺南轉運站,臺南轉運站前身是兵工配件廠，為清領時期鎮署遺構，因此設計時即朝淺基礎與輕量化規劃，並以綠建材及可回收鋼構、貨櫃作為轉運站的主體構造。,(06)2201519,,臺南市,北區,公園路291號,395000000A,臺南市政府,2024/1/9 下午 04:06:59,356000
Attraction_376530000A_000080,Attraction,Zh_tw,屏東縣來義鄉原住民文物館,來義鄉原住民文物館是國內第一座以原住民排灣族五年祭儀為範疇的文物館。館內共有兩層樓，研究、典藏、展示、教育和遊憩功能空間規劃頗為完整，讓大眾能進一步認識、親近豐富的原住民文化。國立臺灣博物館策展之「太陽之子~當神話傳說遇上排灣族」特展，亦在巡迴展出後，將該展七大主題精彩媒體展件全數贈予與該館作為長期展出。,(08)8792202,,屏東縣,來義鄉,南和村289號,376530000A,屏東縣政府,2024/10/15 上午 06:37:50,355000
Attraction_387000000A_000013,Attraction,Zh_tw,八二三紀念公園,臺中「八二三紀念公園」為紀念1958年8月23日共軍砲擊金門所爆發的「八二三砲戰」而設，緬懷當年英勇抵抗、保衛台灣的國軍官兵與民眾。園區陳列陸海空三軍各式裝備，並附有詳細解說牌，展現市府對歷史記憶的重視。雖然部分展示武器並非當年砲戰時所用，而是後續台海防衛所採用的裝備，仍具代表性與教育意義。,(04)22289111,,臺中市,北屯區,昌平東五路,387000000A,臺中市政府觀光旅遊局,2025/5/5 下午 07:07:28,354000
Attraction_379000000A_002175,Attraction,Zh_tw,美堤河濱公園,位於基隆河大直橋至中山高速公路間，面積約42.3公頃。公園是基隆河截彎取直、闢建之後規劃的。公園裡提供完備的運動設施：網球場、羽球場、排球場、籃球場、直排輪練習場&hellip;等，提供給附近居民運動休閒的功能。在這裡，白天可以遠眺大直橋及圓山飯店，不時還可以感受飛機的震撼，晚上大直橋及河岸的燈火雅緻迷人，漫步其間頗富情趣，是大直地區欣賞臺北市夜景和夜遊的最好去處。公園還規劃出一片「自然親水灣區」，除可增加物種的多樣性，亦可透過植物的吸附達到淨化水質的功能。提供市民一處可以生態教育，亦可以欣賞自然景觀之桃花源，有別於其他河濱公園的設備。(資料來源：臺北市政府工務局),(02)27258149,,臺北市,中山區,,379000000A,臺北市政府,2024/9/3 下午 02:25:52,354000
Attraction_397000000A_000667,Attraction,Zh_tw,立德棒球場,位於高雄市中一路的立德棒球場建立於日治時代，民國63年為了紀念立德少棒隊於第28屆威廉波特少棒賽得到世界冠軍而更名，歷史非常悠久，是南部棒球迷的共同熱血記憶。本球場有席位9500個，是全台唯一在內野全部邊線架設鐵網的球場，觀眾可近距離與球星面對面看球，外野看台均有架設頂棚，可遮陽及擋雨。市政府為籌辦2009年世界運動會，配合壘球項目賽事的進行，已將球場軟硬體設施改建，並將外野看台拆除與愛河景觀結合，目前也有意改建成國際標準球場，使位於市區的棒球場發揮綜效功能日益完善。,(07)2710836,,高雄市,前金區,市中一路217號,397000000A,高雄市政府觀光局,2021/5/20 下午 03:18:38,354000
Attraction_376600000A_000038,Attraction,Zh_tw,中正公園,&lt;p&gt;&lt;span style=&quot;font-size: 1.2em;&quot;&gt;市中心最佳的戶外表演場所&lt;/span&gt;&lt;/p&gt;&lt;p&gt;&lt;span style=&quot;font-size: 1.2em;&quot;&gt;中正公園原為平埔洪雅族的諸羅山社公署所在地，清領時期闢為外教場，日治時代創建為公會堂，當時有全台灣最大可容納一千多人的餐廳。二戰後改為中山堂，並闢為康樂區，附設球場及圖書館，『康樂暮鼓』曾為嘉義八景之一，公園的面積雖不大，園內林立的名人雕像群為其特色，其中以素有嘉義媽祖婆之稱許故市長世賢雕像最為聞名。&lt;/span&gt;&lt;/p&gt;&lt;p&gt;&lt;span style=&quot;font-size: 1.2em;&quot;&gt;中正公園於民國78年（西元1989年）完工，園內設露天音樂台，造型採露天拱型開放式，舞台面寬2000公分，深度1670公分，共配置六百個座位，地下室還有演員化妝室，另設有地下收費停車場，貼心的為您解決停車的壓力，為市中心最佳的戶外表演場所。公園內小型展示館作為藝文展場，時常舉辦藝文活動，充滿朝氣與歡樂，景緻及設施都充滿了人文藝術風情，尤其夜間燈火通明，更別具有歐式藝術氣息。&lt;/span&gt;&lt;/p&gt;&lt;p&gt;&lt;span style=&quot;font-size: 1.2em;&quot;&gt;火車站或後火車站下車:&lt;/span&gt;&lt;/p&gt;&lt;p&gt;&lt;span style=&quot;font-size: 1.2em;&quot;&gt;1.搭乘客運於後火車站(先期轉運中心)下車後，搭乘往蘭潭之市區66路(光臨我嘉線)的市區公車，於秀泰影城站下車後步行約8分鐘後即抵達。&lt;br&gt;2.搭乘火車於嘉義火車站下車後，搭乘往港坪運動中心之市區66路(光臨我嘉線)的市區公車，於秀泰影城站下車後步行約10分鐘後即抵達。&lt;br&gt;3.搭乘客運於後火車站(先期轉運中心)下車後，搭乘往嘉大校區之市區1路的市區公車，於彰化銀行站下車後步行約8分鐘後即抵達。&lt;br&gt;4.搭乘火車於嘉義火車站下車後，搭乘往榮民醫院(或二二八國家紀念公園)之市區1路的市區公車，於彰化銀行站下車後步行約8分鐘後即抵達。&lt;br&gt;5.搭乘客運於後火車站(先期轉運中心)下車後，搭乘往大雅站之市區7路的市區公車，於彰化銀行站下車後步行約8分鐘後即抵達。&lt;br&gt;6.搭乘火車於嘉義火車站下車後，搭乘往後火車站(先期轉運中心)之市區7路的市區公車，於彰化銀行站下車後步行約8分鐘後即抵達。&lt;/span&gt;&lt;/p&gt;&lt;p&gt;&lt;span style=&quot;font-size: 1.2em;&quot;&gt;高鐵下車:&lt;/span&gt;&lt;/p&gt;&lt;p&gt;&lt;span style=&quot;font-size: 1.2em;&quot;&gt;1.搭乘高鐵於高鐵嘉義站下車後可搭乘7211與7212brt於台鐵嘉義後站下車後，搭乘往蘭潭之市區66路(光臨我嘉線)的市區公車，於秀泰影城站下車後步行約8分鐘後即抵達。&lt;br&gt;2.搭乘高鐵於高鐵嘉義站下車後可搭乘7211與7212brt於台鐵嘉義後站下車後，搭乘往嘉大校區之市區1路的市區公車，於彰化銀行站下車後步行約8分鐘後即抵達。&lt;br&gt;3.搭乘高鐵於高鐵嘉義站下車後可搭乘7211與7212brt於台鐵嘉義後站下車後，搭乘往大雅站之市區7路的市區公車，於彰化銀行站下車後步行約8分鐘後即抵達。&lt;/span&gt;&lt;/p&gt;,(05)2226270,,嘉義市,西區,位於國華街、民權路、忠義街和北榮街所構築的中央位置,376600000A,嘉義市政府,2021/7/20 下午 03:25:31,353000
Attraction_382000000A_402150,Attraction,Zh_tw,瑞芳老街,古厝懷舊迷人，老街小吃在地美味，登山步道風光明媚,(02)24972250,,新北市,瑞芳區,瑞芳路逢甲路、瑞芳街一帶,382000000A,新北市政府觀光旅遊局,2022/12/5 上午 08:09:01,352000
Attraction_A15011100H_000266,Attraction,Zh_tw,金湖休閒農業區,自行車遊金湖，感受多元漁鄉風情金湖休閒農業區為臺17省道東西兩側，以當地宗教區─萬善爺廟為中心，向外擴展，將屬於口湖鄉的農漁業特產品、景觀資源、生態資源、文化資源等據點做一規劃串聯，園區內有自行車道遊憩路線，豐富的天然景觀資源及多元的地區產業。由金湖萬善爺廟為起始點，經馬蹄蛤主題館，再經金湖臨海休憩園區，沿著口湖鄉濱海自行車道、水岸步道，串聯臺17線經164線至明湖海釣場、傳統食品商行、祥益食品，經雲142公路，最後終點為萬善爺廟。沿途除了欣賞海岸、濕地景觀之外，還可體驗多元的產業活動，如乘膠筏遊漁塭、摸蜆兼洗褲、蛤貝DIY、58度高粱酒烤烏魚子、手工米粉DIY、明湖垂釣樂趣等活動，是一處有別於山區、平原風貌的休閒農漁園區。,(05)7895475,,雲林縣,口湖鄉,雲林縣口湖鄉梧南村光明路163號,A15011100H,交通部觀光署雲嘉南濱海國家風景區管理處,2023/1/5 上午 11:15:10,351000
Attraction_A15010900H_000013,Attraction,Zh_tw,三地門中山公園,中山公園位於三地門鄉中山公園內(三地門鄉公所對面)，是日治時期的忠烈祠所在地，光復後才規劃為公園，為初到三地門遊玩的必遊之地。公園外牆上有六十道百步蛇紋石板，這些雕刻述說著排灣族的神話故事和生活事蹟，傳達了歷史和文化延續的軌跡。園區內的醒目地標-排灣三寶的巨形意象：由琉璃珠、陶壼和青銅刀所組成，展現一種神聖無上的榮耀，是原住民的傳家之寶。此外，在園區內還有著名的三地門文化館，可以欣賞原住民藝術文化的精采作品，和體驗部落族人工藝創作的精髓。建議停留時間約30分鐘，可於公園內散步、欣賞在地藝術家創作的公共藝術作品。,(08)7997245,,屏東縣,三地門鄉,三地村中正路二段110號,A15010900H,交通部觀光署茂林國家風景區管理處,2024/12/4 下午 03:03:15,351000
Attraction_379000000A_003152,Attraction,Zh_tw,永康街區,永康街是位於臺灣臺北市大安區信義路二段上的著名美食街，大致為南北走向，介於金山南路與新生南路之間，北起信義路，南至和平東路，愛國東路口以北為單線雙向道，以南為單行道。因巷弄之間有許多著名餐館或小吃而聞名。永康街是臺北巷弄文化的發源地，對觀光客而言，也是美食薈萃的精華所在，最初以傳統飲食出名，例如鼎泰豐小籠包、秀蘭小館等，開業20幾年的回留餐廳，則是健康飲食風潮的代表，結合了茶店和素食餐廳的特色，且室內可見耀眼裝潢，並有古典音樂繚繞，頗有休閒風尚。另外還有許多文人喜愛的聚所，包括講究臺灣正統茶道的冶堂茶館，與現今康青龍一帶的咖啡廳、茶館，這些巷弄小店的店主對於生活都有一種獨特的經營模式，樂於與人們交談分享生活所醞釀的人文美學。永康街商圈是以「永康公園」為中心，涵蓋永康街、麗水街、部分的金華街，以及街口附近的信義路商店。商圈原先聚集了許多臺灣小吃與餐廳，後來亦漸漸開設了不少異國美食餐廳、許多風格獨具的咖啡館，以及一些精品小店。由於鄰近大安森林公園，再加上擁有許多著名的美食，夜晚或假日往往吸引許多人潮前來。,(02)23515793,,臺北市,大安區,,379000000A,臺北市政府,2024/11/4 下午 05:21:05,351000
Attraction_397000000A_000160,Attraction,Zh_tw,高雄港,位於高雄市南端，是台灣第一大港口、世界第十三大港口,(07)5612311,,高雄市,鼓山區,臨海二路62號,397000000A,高雄市政府觀光局,2020/5/27 上午 11:03:06,349000
Attraction_382000000A_403525,Attraction,Zh_tw,五股夏綠地,翻轉垃圾山，蛻變為兼具環保與藝術的綠地,(02)29603456,,新北市,五股區,中興路四段1之6號,382000000A,新北市政府觀光旅遊局,2022/12/10 下午 09:00:25,349000
Attraction_382000000A_403315,Attraction,Zh_tw,螃蟹主題公園,萬里蟹為主題的海景公園，與活潑可愛的螃蟹公仔合影,(02)4922064,,新北市,萬里區,新北市萬里區漁澳路2號,382000000A,新北市政府觀光旅遊局,2023/3/17 上午 05:22:46,349000
Attraction_376440000A_000245,Attraction,Zh_tw,日本公園,,(03)5881311,,新竹縣,新埔鎮,成功街170巷11號,376440000A,新竹縣政府交通旅遊處,2025/4/29 上午 03:13:55,349000
Attraction_379000000A_000186,Attraction,Zh_tw,台北探索館,身為臺北人，你知道臺北事嗎？歡迎來到台北探索館，瞭解臺北的大小事。台北探索館有4個樓層，1樓為臺北印象廳，以圖文、影像呈現臺北印象；2樓為特展廳，常舉辦相關展覽；3樓為城市探索廳，可看到臺北街道如凱達格蘭大道、中山北路、敦化南北路、忠孝東路等，和西門町、信義區的變遷史；4樓為時空對話廳，有互動裝置，仿古城牆的基石、圖片、文物及模型設施，想瞭解艋舺、大稻埕、臺北城、淡水河的身世，來這裡準沒錯。一樓的臺北印象廳，簡約的風格，讓人馬上聯想到人文薈萃的大臺北調調。主牆面播映的多層次媒體影像及地面投影，展現臺北的一顰一笑。二樓的特展廳，佔地雖然不大， 卻是&quot;麻雀雖小，五臟俱全&quot;，主要配合市府相關局處或市民關心的議題，定期舉辦特展。三樓的城市探索廳，是一個讓人放縱想像力的地方，從臺北街道的變遷，帶觀眾追尋臺北的發展軌跡。四樓的時空對話廳，代表著城市發展與歷史演進，就像搭乘時光機回到過往的臺北，體驗古今對照、時空變換的意境。發現劇場的360度的大螢幕，放映「城市身世」、「城市生活」、「城市風采」、「台北好時光」等4部影片，提出各種關於臺北市的故事與思索，適合各種不同年齡層的民眾，來此探索。民眾來參訪台北探索館前也可以先在網路上觀看展館的雲端虛擬實境喔！,(02)27208889,8630.0,臺北市,信義區,,379000000A,臺北市政府,2024/11/4 下午 05:34:40,348000
Attraction_376530000A_000028,Attraction,Zh_tw,屏東縣原住民文化會館,長久以來遠離故鄉居住於都會的族人，仍希望這個城市中有個屬於自己的家，在此可以看到自己的族人，並溫習自己的語言、傳統工藝與記憶，於是便於年間著手興建此一兼具有博物館功能的文化會館，在此族人可辦理各種的文化藝術活動、會議或研習營隊，這裡成了族人共同的家。,(08)7381479,,屏東縣,屏東市,豐榮街50巷7號,376530000A,屏東縣政府,2024/10/15 上午 06:37:41,348000
Attraction_382000000A_400300,Attraction,Zh_tw,新北市立圖書館,豐富的館藏與舒適的閱覽環境，是新北市的文化地標,(02)29537868,,新北市,板橋區,貴興路139號,382000000A,新北市政府觀光旅遊局,2023/7/5 上午 02:52:03,344000
Attraction_379000000A_003157,Attraction,Zh_tw,濱江果菜市場,濱江果菜市場(第二果菜批發市場)於1985年9月成立，並建立了全國最健全、最先進的果菜拍賣制度，提供生產者、供應商、承銷商與消費者最優質專業的服務。有別於傳統市場，濱江果菜市場除了販售許多嚴選食材，如頂級牛肉、健康豬肉、黃金雞鴨，更以上等海鮮著名，許多菜販會來此批貨，蔬菜新鮮度無庸置疑。此外，因為鄰近臺北松山機場，市場5樓停車場也是欣賞飛機起降的好地方，是飛機迷不可錯過的地點之一。,(02)25162519,,臺北市,中山區,,379000000A,臺北市政府,2024/9/10 下午 10:21:19,344000
Attraction_A13020000G_000087,Attraction,Zh_tw,桃園：大溪老茶廠,"
        【評鑑有效期間：2021/04/15~2024/04/14】


        大溪老茶廠建於1926年，舊名「角板山工場」，保有許多日東紅茶時期的史跡文物與百年歷史綠建築的原貌。工業風格改繕後的陳設空間和簡約內斂的品茶書屋與量少質樸的製茶意象，再生後的老茶廠風華再現。

        建於1926年、占地1,670坪的大溪老茶廠，舊名「角板山工場」。隱身在靜謐小巷弄裡是座融合台、日、英式風格的綠建築，低調清新，百年來風情依舊。 

        自2010年開始，原貌修繕整建，保留了老茶廠挑高建築，未多加修飾，處處流溢著古樸懷舊況味，就為了完美重現老茶廠百年雋永光陰。 

        一個世紀以來，老茶廠的茶葉伴隨著台灣人的記憶，還有一路走來的軌跡。透過建築的無聲氣息與光影，將老廠的溫度傳遞給到訪旅人，在推開門的瞬間，一同領會做茶人與在地文化的真誠回應，伴隨著茶香瀰漫，喚起世代的共同記憶。
      ",(03)3825089,,桃園市,大溪區,復興路二段732巷80號,A13020000G,經濟部產業發展署,2023/11/23 下午 03:45:53,343000
Attraction_376440000A_000348,Attraction,Zh_tw,文化兒童公園,,(03)5515919,,新竹縣,竹北市,吳濁溪路和文平路交叉路口,376440000A,新竹縣政府交通旅遊處,2025/4/28 上午 06:40:40,343000
Attraction_376540000A_000391,Attraction,Zh_tw,東清灣,東清灣是蘭嶼迎接日出的熱門地點，停放在岸上的拼板舟加上千變萬化的日出雲彩，充分呈現出蘭嶼最吸引人的自然與人文樣貌。拂曉時分，一輪紅橙色的太陽緩緩升起，劃破了濃濃的晨霧，兩三艘由黑紅白三色拼合而成的拼板船，慢慢地淡入到前景來，靜悄悄地，似乎有意要讓東清灣在紫霧裡多躺一會兒。這時，朝陽渲染了這天光水色，畫面唯美，朦朧得像莫內《日出．印象》的畫布。這裡，就是東清灣。,(089)731669,,臺東縣,蘭嶼鄉,東側東清村的海灣線上,376540000A,臺東縣政府交通及觀光發展處,2025/3/11 下午 05:27:34,343000
Attraction_376430000A_000963,Attraction,Zh_tw,大溪老茶廠,在和洋融合的風格建築中，用啜飲一杯東方美人茶的時間，和友人一同談天說地，細細領略韶光靜好的悠然，就是最好的回甘滋味。,(03)3825089,,桃園市,大溪區,新峰里1鄰復興路二段732巷80號,376430000A,桃園市政府觀光旅遊局,2025/3/25 上午 11:09:57,343000
Attraction_376440000A_000352,Attraction,Zh_tw,新竹高鐵站,,(02)40663000,,新竹縣,竹北市,高鐵七路6號,376440000A,新竹縣政府交通旅遊處,2025/4/28 上午 07:34:11,342000
